position,lookup_string,team_abbr
K,"K, BAL: J.Tucker (AFC North, ID: 00-0029597)",BAL
K,"K, BUF: T.Bass (AFC East, ID: 00-0036162)",BUF
K,"K, CLE: C.York (AFC North, ID: 00-0038097)",CLE
K,"K, DAL: B.Maher (NFC East, ID: 00-0030332)",DAL
K,"K, DAL: J.Garibay (NFC East, ID: 00-0037567)",DAL
K,"K, DAL: T.Vizcaino (NFC East, ID: 00-0034909)",DAL
K,"K, DET: A.Rosas (NFC North, ID: 00-0032870)",DET
K,"K, DET: A.Seibert (NFC North, ID: 00-0035145)",DET
K,"K, DET: D.Eberle (NFC North, ID: 00-0036168)",DET
K,"K, DET: M.Badgley (NFC North, ID: 00-0034084)",DET
K,"K, DET: S.Ficken (NFC North, ID: 00-0033138)",DET
K,"K, GB: G.Brkic (NFC North, ID: 00-0037492)",GB
K,"K, GB: M.Ammendola (NFC North, ID: 00-0036469)",GB
K,"K, GB: M.Crosby (NFC North, ID: 00-0025580)",GB
K,"K, GB: R.Ahmed (NFC North, ID: 00-0035761)",GB
K,"K, HOU: J.Fairbairn (AFC South, ID: 00-0032726)",HOU
K,"K, KC: H.Butker (AFC West, ID: 00-0033303)",KC
K,"K, KC: M.Wright (AFC West, ID: 00-0035189)",KC
K,"K, LA: M.Gay (NFC West, ID: 00-0035269)",LA
K,"K, MIA: J.Sanders (AFC East, ID: 00-0034794)",MIA
K,"K, PHI: J.Elliott (NFC East, ID: 00-0033787)",PHI
K,"K, PIT: C.Boswell (AFC North, ID: 00-0031136)",PIT
K,"K, PIT: N.Sciba (AFC North, ID: 00-0037645)",PIT
K,"K, SF: R.Gould (NFC West, ID: 00-0023252)",SF
K,"K, SF: S.Sloman (NFC West, ID: 00-0036436)",SF
K,"K, TB: J.Borregales (NFC South, ID: 00-0036757)",TB
K,"K, TB: R.Succop (NFC South, ID: 00-0026968)",TB
QB,"QB, BAL: A.Brown (AFC North, ID: 00-0037175)",BAL
QB,"QB, BAL: B.Hundley (AFC North, ID: 00-0031589)",BAL
QB,"QB, BAL: L.Jackson (AFC North, ID: 00-0034796)",BAL
QB,"QB, BAL: T.Huntley (AFC North, ID: 00-0035993)",BAL
QB,"QB, BUF: C.Keenum (AFC East, ID: 00-0028986)",BUF
QB,"QB, BUF: J.Allen (AFC East, ID: 00-0034857)",BUF
QB,"QB, BUF: M.Barkley (AFC East, ID: 00-0030533)",BUF
QB,"QB, CLE: D.Watson (AFC North, ID: 00-0033537)",CLE
QB,"QB, CLE: J.Brissett (AFC North, ID: 00-0033119)",CLE
QB,"QB, CLE: K.Mond (AFC North, ID: 00-0036946)",CLE
QB,"QB, DAL: B.DiNucci (NFC East, ID: 00-0036384)",DAL
QB,"QB, DAL: C.Rush (NFC East, ID: 00-0033662)",DAL
QB,"QB, DAL: R.Prescott (NFC East, ID: 00-0033077)",DAL
QB,"QB, DAL: W.Grier (NFC East, ID: 00-0035251)",DAL
QB,"QB, DET: J.Goff (NFC North, ID: 00-0033106)",DET
QB,"QB, DET: N.Sudfeld (NFC North, ID: 00-0032792)",DET
QB,"QB, DET: S.Montez (NFC North, ID: 00-0036022)",DET
QB,"QB, GB: A.Rodgers (NFC North, ID: 00-0023459)",GB
QB,"QB, GB: D.Etling (NFC North, ID: 00-0034423)",GB
QB,"QB, GB: J.Love (NFC North, ID: 00-0036264)",GB
QB,"QB, HOU: D.Mills (AFC South, ID: 00-0036898)",HOU
QB,"QB, HOU: J.Driskel (AFC South, ID: 00-0032436)",HOU
QB,"QB, HOU: K.Allen (AFC South, ID: 00-0034577)",HOU
QB,"QB, KC: C.Henne (AFC West, ID: 00-0026197)",KC
QB,"QB, KC: C.Oladokun (AFC West, ID: 00-0037324)",KC
QB,"QB, KC: D.Crum (AFC West, ID: 00-0037209)",KC
QB,"QB, KC: P.Mahomes (AFC West, ID: 00-0033873)",KC
QB,"QB, KC: S.Buechele (AFC West, ID: 00-0036679)",KC
QB,"QB, LA: B.Mayfield (NFC West, ID: 00-0034855)",LA
QB,"QB, LA: B.Perkins (NFC West, ID: 00-0035939)",LA
QB,"QB, LA: J.Stafford (NFC West, ID: 00-0026498)",LA
QB,"QB, LA: J.Wolford (NFC West, ID: 00-0034899)",LA
QB,"QB, LA: S.Cookus (NFC West, ID: 00-0035812)",LA
QB,"QB, MIA: J.Lovett (AFC East, ID: 00-0035161)",MIA
QB,"QB, MIA: M.Glennon (AFC East, ID: 00-0030520)",MIA
QB,"QB, MIA: R.Sinnett (AFC East, ID: 00-0036052)",MIA
QB,"QB, MIA: S.Thompson (AFC East, ID: 00-0037327)",MIA
QB,"QB, MIA: T.Bridgewater (AFC East, ID: 00-0031237)",MIA
QB,"QB, MIA: T.Tagovailoa (AFC East, ID: 00-0036212)",MIA
QB,"QB, PHI: G.Minshew (NFC East, ID: 00-0035289)",PHI
QB,"QB, PHI: I.Book (NFC East, ID: 00-0036929)",PHI
QB,"QB, PHI: J.Hurts (NFC East, ID: 00-0036389)",PHI
QB,"QB, PIT: K.Pickett (AFC North, ID: 00-0038102)",PIT
QB,"QB, PIT: M.Rudolph (AFC North, ID: 00-0034771)",PIT
QB,"QB, PIT: M.Trubisky (AFC North, ID: 00-0033869)",PIT
QB,"QB, SF: B.Purdy (NFC West, ID: 00-0037834)",SF
QB,"QB, SF: J.Eason (NFC West, ID: 00-0036226)",SF
QB,"QB, SF: J.Garoppolo (NFC West, ID: 00-0031345)",SF
QB,"QB, SF: J.Johnson (NFC West, ID: 00-0026300)",SF
QB,"QB, SF: K.Benkert (NFC West, ID: 00-0034131)",SF
QB,"QB, SF: T.Lance (NFC West, ID: 00-0037012)",SF
QB,"QB, TB: B.Gabbert (NFC South, ID: 00-0027948)",TB
QB,"QB, TB: K.Trask (NFC South, ID: 00-0036928)",TB
QB,"QB, TB: R.Griffin (NFC South, ID: 00-0029857)",TB
QB,"QB, TB: T.Brady (NFC South, ID: 00-0019596)",TB
RB,"RB, BAL: G.Edwards (AFC North, ID: 00-0034184)",BAL
RB,"RB, BAL: J.Dobbins (AFC North, ID: 00-0036158)",BAL
RB,"RB, BAL: J.Hill (AFC North, ID: 00-0034975)",BAL
RB,"RB, BAL: K.Drake (AFC North, ID: 00-0033118)",BAL
RB,"RB, BAL: M.Davis (AFC North, ID: 00-0032063)",BAL
RB,"RB, BAL: P.Ricard (AFC North, ID: 00-0033376)",BAL
RB,"RB, BAL: R.Person (AFC North, ID: 00-0037182)",BAL
RB,"RB, BUF: D.Singletary (AFC East, ID: 00-0035250)",BUF
RB,"RB, BUF: J.Cook (AFC East, ID: 00-0037248)",BUF
RB,"RB, BUF: N.Hines (AFC East, ID: 00-0034367)",BUF
RB,"RB, BUF: R.Gilliam (AFC East, ID: 00-0036187)",BUF
RB,"RB, BUF: R.Johnson (AFC East, ID: 00-0032257)",BUF
RB,"RB, BUF: T.Jones (AFC East, ID: 00-0028063)",BUF
RB,"RB, CLE: D.Felton (AFC North, ID: 00-0036654)",CLE
RB,"RB, CLE: D.Johnson (AFC North, ID: 00-0035628)",CLE
RB,"RB, CLE: J.Ford (AFC North, ID: 00-0037267)",CLE
RB,"RB, CLE: J.Kelly (AFC North, ID: 00-0034808)",CLE
RB,"RB, CLE: J.Stanton (AFC North, ID: 00-0034311)",CLE
RB,"RB, CLE: K.Hunt (AFC North, ID: 00-0033923)",CLE
RB,"RB, CLE: N.Chubb (AFC North, ID: 00-0034791)",CLE
RB,"RB, DAL: E.Elliott (NFC East, ID: 00-0033045)",DAL
RB,"RB, DAL: M.Davis (NFC East, ID: 00-0037563)",DAL
RB,"RB, DAL: N.Ralston (NFC East, ID: 00-0036774)",DAL
RB,"RB, DAL: Q.Ollison (NFC East, ID: 00-0035273)",DAL
RB,"RB, DAL: R.Dowdle (NFC East, ID: 00-0036139)",DAL
RB,"RB, DAL: R.Nall (NFC East, ID: 00-0034597)",DAL
RB,"RB, DAL: T.Pollard (NFC East, ID: 00-0035261)",DAL
RB,"RB, DET: C.Reynolds (NFC North, ID: 00-0035567)",DET
RB,"RB, DET: D.Swift (NFC North, ID: 00-0036275)",DET
RB,"RB, DET: G.Bell (NFC North, ID: 00-0037437)",DET
RB,"RB, DET: J.Cabinda (NFC North, ID: 00-0034171)",DET
RB,"RB, DET: J.Jackson (NFC North, ID: 00-0034440)",DET
RB,"RB, DET: J.Jefferson (NFC North, ID: 00-0036670)",DET
RB,"RB, DET: J.Williams (NFC North, ID: 00-0033948)",DET
RB,"RB, GB: A.Dillon (NFC North, ID: 00-0036265)",GB
RB,"RB, GB: A.Jones (NFC North, ID: 00-0033293)",GB
RB,"RB, GB: D.Williams (NFC North, ID: 00-0034995)",GB
RB,"RB, GB: K.Hill (NFC North, ID: 00-0036669)",GB
RB,"RB, GB: P.Taylor (NFC North, ID: 00-0035973)",GB
RB,"RB, GB: T.Goodson (NFC North, ID: 00-0037120)",GB
RB,"RB, HOU: A.Janovich (AFC South, ID: 00-0032956)",HOU
RB,"RB, HOU: D.Anderson (AFC South, ID: 00-0036027)",HOU
RB,"RB, HOU: D.Pierce (AFC South, ID: 00-0037258)",HOU
RB,"RB, HOU: G.Doaks (AFC South, ID: 00-0036578)",HOU
RB,"RB, HOU: M.Burkhead (AFC South, ID: 00-0030288)",HOU
RB,"RB, HOU: O.Ogunbowale (AFC South, ID: 00-0033854)",HOU
RB,"RB, HOU: P.Quessenberry (AFC South, ID: 00-0036453)",HOU
RB,"RB, HOU: R.Freeman (AFC South, ID: 00-0034838)",HOU
RB,"RB, HOU: S.Phillips (AFC South, ID: 00-0036069)",HOU
RB,"RB, HOU: T.Hairston (AFC South, ID: 00-0037456)",HOU
RB,"RB, KC: C.Edwards-Helaire (AFC West, ID: 00-0036360)",KC
RB,"RB, KC: I.Pacheco (AFC West, ID: 00-0037197)",KC
RB,"RB, KC: J.Ealy (AFC West, ID: 00-0037210)",KC
RB,"RB, KC: J.McKinnon (AFC West, ID: 00-0031376)",KC
RB,"RB, KC: L.Perine (AFC West, ID: 00-0036269)",KC
RB,"RB, KC: M.Burton (AFC West, ID: 00-0031595)",KC
RB,"RB, KC: M.Gordon (AFC West, ID: 00-0032144)",KC
RB,"RB, KC: R.Jones (AFC West, ID: 00-0034816)",KC
RB,"RB, KC: T.Fleet-Davis (AFC West, ID: 00-0037211)",KC
RB,"RB, LA: C.Akers (NFC West, ID: 00-0036414)",LA
RB,"RB, LA: K.Williams (NFC West, ID: 00-0037840)",LA
RB,"RB, LA: M.Brown (NFC West, ID: 00-0031806)",LA
RB,"RB, LA: R.Calais (NFC West, ID: 00-0036435)",LA
RB,"RB, LA: R.Rivers (NFC West, ID: 00-0037557)",LA
RB,"RB, LA: T.Ragas (NFC West, ID: 00-0036523)",LA
RB,"RB, LA: X.Jones (NFC West, ID: 00-0036078)",LA
RB,"RB, MIA: A.Ingold (AFC East, ID: 00-0035125)",MIA
RB,"RB, MIA: D.Mostert (AFC East, ID: 00-0031687)",MIA
RB,"RB, MIA: J.Bargas (AFC East, ID: 00-0035975)",MIA
RB,"RB, MIA: J.Wilson (AFC East, ID: 00-0034115)",MIA
RB,"RB, MIA: M.Gaskin (AFC East, ID: 00-0035311)",MIA
RB,"RB, MIA: S.Ahmed (AFC East, ID: 00-0036020)",MIA
RB,"RB, MIA: Z.White (AFC East, ID: 00-0037357)",MIA
RB,"RB, PHI: B.Scott (NFC East, ID: 00-0034414)",PHI
RB,"RB, PHI: K.Brooks (NFC East, ID: 00-0037131)",PHI
RB,"RB, PHI: K.Gainwell (NFC East, ID: 00-0036919)",PHI
RB,"RB, PHI: M.Sanders (NFC East, ID: 00-0035243)",PHI
RB,"RB, PHI: T.Sermon (NFC East, ID: 00-0036984)",PHI
RB,"RB, PIT: A.McFarland (AFC North, ID: 00-0036336)",PIT
RB,"RB, PIT: B.Snell (AFC North, ID: 00-0035217)",PIT
RB,"RB, PIT: D.Watt (AFC North, ID: 00-0032897)",PIT
RB,"RB, PIT: F.Edmunds (AFC North, ID: 00-0033838)",PIT
RB,"RB, PIT: J.Huntley (AFC North, ID: 00-0036278)",PIT
RB,"RB, PIT: J.McNichols (AFC North, ID: 00-0033955)",PIT
RB,"RB, PIT: J.Warren (AFC North, ID: 00-0037228)",PIT
RB,"RB, PIT: M.Borghi (AFC North, ID: 00-0037389)",PIT
RB,"RB, PIT: M.Durant (AFC North, ID: 00-0037226)",PIT
RB,"RB, PIT: M.Teague (AFC North, ID: 00-0037111)",PIT
RB,"RB, PIT: N.Harris (AFC North, ID: 00-0036893)",PIT
RB,"RB, SF: C.McCaffrey (NFC West, ID: 00-0033280)",SF
RB,"RB, SF: E.Mitchell (NFC West, ID: 00-0036567)",SF
RB,"RB, SF: F.Gore (NFC West, ID: 00-0023500)",SF
RB,"RB, SF: J.Hokit (NFC West, ID: 00-0035807)",SF
RB,"RB, SF: J.Mason (NFC West, ID: 00-0037525)",SF
RB,"RB, SF: K.Juszczyk (NFC West, ID: 00-0029892)",SF
RB,"RB, SF: T.Coleman (NFC West, ID: 00-0032058)",SF
RB,"RB, SF: T.Davis-Price (NFC West, ID: 00-0037827)",SF
RB,"RB, TB: G.Bernard (NFC South, ID: 00-0030456)",TB
RB,"RB, TB: K.Barner (NFC South, ID: 00-0030465)",TB
RB,"RB, TB: K.Vaughn (NFC South, ID: 00-0036450)",TB
RB,"RB, TB: L.Fournette (NFC South, ID: 00-0033856)",TB
RB,"RB, TB: P.Laird (NFC South, ID: 00-0035342)",TB
RB,"RB, TB: R.White (NFC South, ID: 00-0037256)",TB
TE,"TE, BAL: B.Mason (AFC North, ID: 00-0036565)",BAL
TE,"TE, BAL: C.Kolar (AFC North, ID: 00-0038046)",BAL
TE,"TE, BAL: I.Likely (AFC North, ID: 00-0037838)",BAL
TE,"TE, BAL: J.Oliver (AFC North, ID: 00-0035249)",BAL
TE,"TE, BAL: M.Andrews (AFC North, ID: 00-0034753)",BAL
TE,"TE, BAL: N.Boyle (AFC North, ID: 00-0031598)",BAL
TE,"TE, BAL: T.Poljan (AFC North, ID: 00-0036583)",BAL
TE,"TE, BUF: D.Knox (AFC East, ID: 00-0035689)",BUF
TE,"TE, BUF: Q.Morris (AFC East, ID: 00-0036590)",BUF
TE,"TE, BUF: T.Sweeney (AFC East, ID: 00-0035308)",BUF
TE,"TE, BUF: Z.Davidson (AFC East, ID: 00-0036640)",BUF
TE,"TE, CLE: D.Njoku (AFC North, ID: 00-0033885)",CLE
TE,"TE, CLE: H.Bryant (AFC North, ID: 00-0036232)",CLE
TE,"TE, CLE: J.James (AFC North, ID: 00-0032135)",CLE
TE,"TE, CLE: M.Forristall (AFC North, ID: 00-0036692)",CLE
TE,"TE, CLE: M.Santos-Silva (AFC North, ID: 00-0037044)",CLE
TE,"TE, CLE: P.Brown (AFC North, ID: 00-0033439)",CLE
TE,"TE, CLE: Z.Mitchell-Paden (AFC North, ID: 00-0037340)",CLE
TE,"TE, DAL: D.Schultz (NFC East, ID: 00-0034383)",DAL
TE,"TE, DAL: I.Bunting (NFC East, ID: 00-0035067)",DAL
TE,"TE, DAL: J.Ferguson (NFC East, ID: 00-0038041)",DAL
TE,"TE, DAL: J.Sprinkle (NFC East, ID: 00-0033528)",DAL
TE,"TE, DAL: P.Hendershot (NFC East, ID: 00-0037569)",DAL
TE,"TE, DAL: S.Green (NFC East, ID: 00-0037455)",DAL
TE,"TE, DAL: S.McKeon (NFC East, ID: 00-0036032)",DAL
TE,"TE, DET: B.Wright (NFC North, ID: 00-0036754)",DET
TE,"TE, DET: D.Deese (NFC North, ID: 00-0037439)",DET
TE,"TE, DET: D.Funchess (NFC North, ID: 00-0032055)",DET
TE,"TE, DET: G.Griffin (NFC North, ID: 00-0033095)",DET
TE,"TE, DET: J.Mitchell (NFC North, ID: 00-0037282)",DET
TE,"TE, DET: N.Givan (NFC North, ID: 00-0037462)",DET
TE,"TE, DET: S.Zylstra (NFC North, ID: 00-0036534)",DET
TE,"TE, GB: A.Allen (NFC North, ID: 00-0037369)",GB
TE,"TE, GB: A.Mack (NFC North, ID: 00-0035309)",GB
TE,"TE, GB: J.Babicz (NFC North, ID: 00-0037359)",GB
TE,"TE, GB: J.Deguara (NFC North, ID: 00-0036332)",GB
TE,"TE, GB: M.Lewis (NFC North, ID: 00-0024243)",GB
TE,"TE, GB: N.Becker (NFC North, ID: 00-0035322)",GB
TE,"TE, GB: N.Guggemos (NFC North, ID: 00-0036489)",GB
TE,"TE, GB: R.Tonyan (NFC North, ID: 00-0033757)",GB
TE,"TE, GB: S.Beyer (NFC North, ID: 00-0036718)",GB
TE,"TE, GB: S.Cannella (NFC North, ID: 00-0037015)",GB
TE,"TE, GB: T.Davis (NFC North, ID: 00-0036250)",GB
TE,"TE, HOU: B.Jordan (AFC South, ID: 00-0036556)",HOU
TE,"TE, HOU: J.Akins (AFC South, ID: 00-0034364)",HOU
TE,"TE, HOU: M.Schreck (AFC South, ID: 00-0033798)",HOU
TE,"TE, HOU: N.Eubanks (AFC South, ID: 00-0036766)",HOU
TE,"TE, HOU: O.Howard (AFC South, ID: 00-0033879)",HOU
TE,"TE, HOU: T.Quitoriano (AFC South, ID: 00-0037277)",HOU
TE,"TE, KC: B.Bell (AFC West, ID: 00-0032062)",KC
TE,"TE, KC: J.Fortson (AFC West, ID: 00-0035547)",KC
TE,"TE, KC: J.Franks (AFC West, ID: 00-0034532)",KC
TE,"TE, KC: K.Blanton (AFC West, ID: 00-0035603)",KC
TE,"TE, KC: K.Oginni (AFC West, ID: 00-0037213)",KC
TE,"TE, KC: M.Bushman (AFC West, ID: 00-0036519)",KC
TE,"TE, KC: M.Vital (AFC West, ID: 00-0037036)",KC
TE,"TE, KC: N.Gray (AFC West, ID: 00-0036637)",KC
TE,"TE, KC: T.Kelce (AFC West, ID: 00-0030506)",KC
TE,"TE, LA: B.Hopkins (NFC West, ID: 00-0036424)",LA
TE,"TE, LA: J.Pettigrew (NFC West, ID: 00-0037059)",LA
TE,"TE, LA: J.Pinkney (NFC West, ID: 00-0035787)",LA
TE,"TE, LA: K.Markway (NFC West, ID: 00-0035817)",LA
TE,"TE, LA: R.Carter (NFC West, ID: 00-0037632)",LA
TE,"TE, LA: T.Higbee (NFC West, ID: 00-0033110)",LA
TE,"TE, MIA: A.Shaheen (AFC East, ID: 00-0033896)",MIA
TE,"TE, MIA: C.Carter (AFC East, ID: 00-0033338)",MIA
TE,"TE, MIA: D.Smythe (AFC East, ID: 00-0034798)",MIA
TE,"TE, MIA: H.Long (AFC East, ID: 00-0037004)",MIA
TE,"TE, MIA: M.Gesicki (AFC East, ID: 00-0034829)",MIA
TE,"TE, PHI: D.Goedert (NFC East, ID: 00-0034351)",PHI
TE,"TE, PHI: D.Keene (NFC East, ID: 00-0036225)",PHI
TE,"TE, PHI: G.Calcaterra (NFC East, ID: 00-0037086)",PHI
TE,"TE, PHI: J.Graham (NFC East, ID: 00-0034788)",PHI
TE,"TE, PHI: J.Stoll (NFC East, ID: 00-0036741)",PHI
TE,"TE, PHI: N.Togiai (NFC East, ID: 00-0036005)",PHI
TE,"TE, PHI: T.Jackson (NFC East, ID: 00-0035356)",PHI
TE,"TE, PIT: C.Heyward (AFC North, ID: 00-0037304)",PIT
TE,"TE, PIT: J.Rigg (AFC North, ID: 00-0037424)",PIT
TE,"TE, PIT: J.Sternberger (AFC North, ID: 00-0035671)",PIT
TE,"TE, PIT: P.Freiermuth (AFC North, ID: 00-0036894)",PIT
TE,"TE, PIT: R.Williams (AFC North, ID: 00-0037451)",PIT
TE,"TE, PIT: Z.Gentry (AFC North, ID: 00-0035222)",PIT
TE,"TE, SF: C.Woerner (NFC West, ID: 00-0036429)",SF
TE,"TE, SF: G.Kittle (NFC West, ID: 00-0033288)",SF
TE,"TE, SF: J.Matthews (NFC West, ID: 00-0031299)",SF
TE,"TE, SF: R.Dwelley (NFC West, ID: 00-0034073)",SF
TE,"TE, SF: T.Fumagalli (NFC West, ID: 00-0034393)",SF
TE,"TE, SF: T.Kroft (NFC West, ID: 00-0032214)",SF
TE,"TE, TB: B.Beise (NFC South, ID: 00-0037490)",TB
TE,"TE, TB: C.Brate (NFC South, ID: 00-0031273)",TB
TE,"TE, TB: C.McElroy (NFC South, ID: 00-0034735)",TB
TE,"TE, TB: C.Otton (NFC South, ID: 00-0038129)",TB
TE,"TE, TB: D.Wells (NFC South, ID: 00-0034575)",TB
TE,"TE, TB: J.Howland (NFC South, ID: 00-0037631)",TB
TE,"TE, TB: K.Kieft (NFC South, ID: 00-0037311)",TB
TE,"TE, TB: K.Rudolph (NFC South, ID: 00-0027981)",TB
WR,"WR, BAL: A.Isabella (AFC North, ID: 00-0035527)",BAL
WR,"WR, BAL: B.Gaither (AFC North, ID: 00-0036787)",BAL
WR,"WR, BAL: B.Victor (AFC North, ID: 00-0035819)",BAL
WR,"WR, BAL: D.Duvernay (AFC North, ID: 00-0036331)",BAL
WR,"WR, BAL: D.Jackson (AFC North, ID: 00-0026189)",BAL
WR,"WR, BAL: D.Robinson (AFC North, ID: 00-0032775)",BAL
WR,"WR, BAL: D.Williams (AFC North, ID: 00-0037187)",BAL
WR,"WR, BAL: J.Proche (AFC North, ID: 00-0036133)",BAL
WR,"WR, BAL: M.Thomas (AFC North, ID: 00-0033114)",BAL
WR,"WR, BAL: R.Bateman (AFC North, ID: 00-0036550)",BAL
WR,"WR, BAL: S.Bolden (AFC North, ID: 00-0037173)",BAL
WR,"WR, BAL: S.Bridges (AFC North, ID: 00-0037174)",BAL
WR,"WR, BAL: S.Watkins (AFC North, ID: 00-0031325)",BAL
WR,"WR, BAL: T.Black (AFC North, ID: 00-0036491)",BAL
WR,"WR, BAL: T.Clark (AFC North, ID: 00-0037176)",BAL
WR,"WR, BAL: T.Wallace (AFC North, ID: 00-0036630)",BAL
WR,"WR, BUF: A.Gentry (AFC East, ID: 00-0033633)",BUF
WR,"WR, BUF: C.Beasley (AFC East, ID: 00-0029000)",BUF
WR,"WR, BUF: D.Patmon (AFC East, ID: 00-0036228)",BUF
WR,"WR, BUF: G.Davis (AFC East, ID: 00-0036196)",BUF
WR,"WR, BUF: I.Coulter (AFC East, ID: 00-0036308)",BUF
WR,"WR, BUF: I.McKenzie (AFC East, ID: 00-0033466)",BUF
WR,"WR, BUF: J.Brown (AFC East, ID: 00-0031051)",BUF
WR,"WR, BUF: J.Crowder (AFC East, ID: 00-0031941)",BUF
WR,"WR, BUF: J.Kumerow (AFC East, ID: 00-0031787)",BUF
WR,"WR, BUF: K.Johnson (AFC East, ID: 00-0035287)",BUF
WR,"WR, BUF: K.Shakir (AFC East, ID: 00-0037261)",BUF
WR,"WR, BUF: N.Pau'u (AFC East, ID: 00-0037434)",BUF
WR,"WR, BUF: S.Diggs (AFC East, ID: 00-0031588)",BUF
WR,"WR, BUF: T.Austin (AFC East, ID: 00-0030525)",BUF
WR,"WR, CLE: A.Cooper (AFC North, ID: 00-0031544)",CLE
WR,"WR, CLE: A.Schwartz (AFC North, ID: 00-0036999)",CLE
WR,"WR, CLE: C.Grayson (AFC North, ID: 00-0033215)",CLE
WR,"WR, CLE: C.Rogers (AFC North, ID: 00-0032355)",CLE
WR,"WR, CLE: D.Baldwin (AFC North, ID: 00-0038147)",CLE
WR,"WR, CLE: D.Bell (AFC North, ID: 00-0037257)",CLE
WR,"WR, CLE: D.Peoples-Jones (AFC North, ID: 00-0036233)",CLE
WR,"WR, CLE: I.Weston (AFC North, ID: 00-0037343)",CLE
WR,"WR, CLE: J.Darden (AFC North, ID: 00-0036877)",CLE
WR,"WR, CLE: J.Grant (AFC North, ID: 00-0032791)",CLE
WR,"WR, CLE: M.Harley (AFC North, ID: 00-0037334)",CLE
WR,"WR, CLE: M.Stevenson (AFC North, ID: 00-0036571)",CLE
WR,"WR, CLE: M.Woods (AFC North, ID: 00-0037300)",CLE
WR,"WR, CLE: T.Harris (AFC North, ID: 00-0037335)",CLE
WR,"WR, DAL: A.Callaway (NFC East, ID: 00-0034772)",DAL
WR,"WR, DAL: B.Smith (NFC East, ID: 00-0036775)",DAL
WR,"WR, DAL: C.Lamb (NFC East, ID: 00-0036358)",DAL
WR,"WR, DAL: D.Drummond (NFC East, ID: 00-0037564)",DAL
WR,"WR, DAL: D.Houston (NFC East, ID: 00-0037570)",DAL
WR,"WR, DAL: E.Hilton (NFC East, ID: 00-0029608)",DAL
WR,"WR, DAL: J.Tolbert (NFC East, ID: 00-0037666)",DAL
WR,"WR, DAL: K.Turpin (NFC East, ID: 00-0037801)",DAL
WR,"WR, DAL: M.Gallup (NFC East, ID: 00-0034764)",DAL
WR,"WR, DAL: N.Brown (NFC East, ID: 00-0033591)",DAL
WR,"WR, DAL: S.Fehoko (NFC East, ID: 00-0036646)",DAL
WR,"WR, DAL: T.Vasher (NFC East, ID: 00-0036776)",DAL
WR,"WR, DET: A.St. Brown (NFC North, ID: 00-0036963)",DET
WR,"WR, DET: B.Zylstra (NFC North, ID: 00-0034052)",DET
WR,"WR, DET: C.Sutton (NFC North, ID: 00-0037444)",DET
WR,"WR, DET: D.Chark (NFC North, ID: 00-0034777)",DET
WR,"WR, DET: J.Johnson (NFC North, ID: 00-0037442)",DET
WR,"WR, DET: J.Reynolds (NFC North, ID: 00-0033943)",DET
WR,"WR, DET: J.Williams (NFC North, ID: 00-0037240)",DET
WR,"WR, DET: K.Raymond (NFC North, ID: 00-0032464)",DET
WR,"WR, DET: M.Alexander (NFC North, ID: 00-0037708)",DET
WR,"WR, DET: Q.Cephus (NFC North, ID: 00-0036277)",DET
WR,"WR, DET: S.Berryhill (NFC North, ID: 00-0037581)",DET
WR,"WR, DET: T.Benson (NFC North, ID: 00-0034930)",DET
WR,"WR, DET: T.Kennedy (NFC North, ID: 00-0035544)",DET
WR,"WR, GB: A.Lazard (NFC North, ID: 00-0034521)",GB
WR,"WR, GB: B.Melton (NFC North, ID: 00-0037091)",GB
WR,"WR, GB: C.Watson (NFC North, ID: 00-0038124)",GB
WR,"WR, GB: D.Davis (NFC North, ID: 00-0037119)",GB
WR,"WR, GB: D.Westbrook (NFC North, ID: 00-0033839)",GB
WR,"WR, GB: I.Hyman (NFC North, ID: 00-0034922)",GB
WR,"WR, GB: J.Cotton (NFC North, ID: 00-0035901)",GB
WR,"WR, GB: J.Winfree (NFC North, ID: 00-0035593)",GB
WR,"WR, GB: O.Mitchell (NFC North, ID: 00-0036773)",GB
WR,"WR, GB: R.Cobb (NFC North, ID: 00-0028002)",GB
WR,"WR, GB: R.Doubs (NFC North, ID: 00-0037816)",GB
WR,"WR, GB: R.Gafford (NFC North, ID: 00-0034660)",GB
WR,"WR, GB: S.Toure (NFC North, ID: 00-0037098)",GB
WR,"WR, GB: T.Fulgham (NFC North, ID: 00-0035592)",GB
WR,"WR, HOU: A.Bachman (AFC South, ID: 00-0035602)",HOU
WR,"WR, HOU: A.Rodgers (AFC South, ID: 00-0036991)",HOU
WR,"WR, HOU: B.Cooks (AFC South, ID: 00-0031236)",HOU
WR,"WR, HOU: C.Beebe (AFC South, ID: 00-0034309)",HOU
WR,"WR, HOU: C.Moore (AFC South, ID: 00-0032398)",HOU
WR,"WR, HOU: D.Davis (AFC South, ID: 00-0035101)",HOU
WR,"WR, HOU: D.Estrada (AFC South, ID: 00-0037454)",HOU
WR,"WR, HOU: D.Montgomery (AFC South, ID: 00-0035045)",HOU
WR,"WR, HOU: J.Camp (AFC South, ID: 00-0036858)",HOU
WR,"WR, HOU: J.Johnson (AFC South, ID: 00-0037460)",HOU
WR,"WR, HOU: J.Metchie (AFC South, ID: 00-0037614)",HOU
WR,"WR, HOU: M.Turner (AFC South, ID: 00-0034867)",HOU
WR,"WR, HOU: M.Young (AFC South, ID: 00-0037409)",HOU
WR,"WR, HOU: N.Collins (AFC South, ID: 00-0036554)",HOU
WR,"WR, HOU: P.Dorsett (AFC South, ID: 00-0032208)",HOU
WR,"WR, KC: A.Parker (AFC West, ID: 00-0036034)",KC
WR,"WR, KC: B.Edwards (AFC West, ID: 00-0036365)",KC
WR,"WR, KC: C.Coleman (AFC West, ID: 00-0032966)",KC
WR,"WR, KC: C.Powell (AFC West, ID: 00-0036647)",KC
WR,"WR, KC: G.Jennings (AFC West, ID: 00-0035589)",KC
WR,"WR, KC: I.Smith-Marsette (AFC West, ID: 00-0036635)",KC
WR,"WR, KC: J.Ross (AFC West, ID: 00-0033460)",KC
WR,"WR, KC: J.Ross (AFC West, ID: 00-0037216)",KC
WR,"WR, KC: J.Smith-Schuster (AFC West, ID: 00-0033857)",KC
WR,"WR, KC: J.Watson (AFC West, ID: 00-0034386)",KC
WR,"WR, KC: K.Toney (AFC West, ID: 00-0036913)",KC
WR,"WR, KC: M.Hardman (AFC West, ID: 00-0035140)",KC
WR,"WR, KC: M.Kemp (AFC West, ID: 00-0033481)",KC
WR,"WR, KC: M.Sexton (AFC West, ID: 00-0036471)",KC
WR,"WR, KC: M.Valdes-Scantling (AFC West, ID: 00-0034272)",KC
WR,"WR, KC: O.Bayless (AFC West, ID: 00-0035947)",KC
WR,"WR, KC: S.Moore (AFC West, ID: 00-0038090)",KC
WR,"WR, KC: T.Fryfogle (AFC West, ID: 00-0037566)",KC
WR,"WR, LA: A.Robinson (NFC West, ID: 00-0031428)",LA
WR,"WR, LA: A.Trammell (NFC West, ID: 00-0036841)",LA
WR,"WR, LA: B.Powell (NFC West, ID: 00-0034646)",LA
WR,"WR, LA: B.Skowronek (NFC West, ID: 00-0036862)",LA
WR,"WR, LA: C.Atwell (NFC West, ID: 00-0036849)",LA
WR,"WR, LA: C.Kupp (NFC West, ID: 00-0033908)",LA
WR,"WR, LA: J.Harris (NFC West, ID: 00-0036918)",LA
WR,"WR, LA: J.Koski (NFC West, ID: 00-0035935)",LA
WR,"WR, LA: J.Roberson (NFC West, ID: 00-0037574)",LA
WR,"WR, LA: J.Sterns (NFC West, ID: 00-0037486)",LA
WR,"WR, LA: L.Akers (NFC West, ID: 00-0036598)",LA
WR,"WR, LA: L.Lenoir (NFC West, ID: 00-0033992)",LA
WR,"WR, LA: L.McCutcheon (NFC West, ID: 00-0037055)",LA
WR,"WR, LA: V.Jefferson (NFC West, ID: 00-0036415)",LA
WR,"WR, LA: W.Jackson (NFC West, ID: 00-0036721)",LA
WR,"WR, MIA: B.Sanders (AFC East, ID: 00-0037355)",MIA
WR,"WR, MIA: C.Core (AFC East, ID: 00-0032795)",MIA
WR,"WR, MIA: C.Jackson (AFC East, ID: 00-0037221)",MIA
WR,"WR, MIA: C.Wilson (AFC East, ID: 00-0034418)",MIA
WR,"WR, MIA: D.Dedmon (AFC East, ID: 00-0037029)",MIA
WR,"WR, MIA: D.Hamilton (AFC East, ID: 00-0034370)",MIA
WR,"WR, MIA: E.Ezukanma (AFC East, ID: 00-0038092)",MIA
WR,"WR, MIA: J.Waddle (AFC East, ID: 00-0036613)",MIA
WR,"WR, MIA: M.Sanu (AFC East, ID: 00-0029632)",MIA
WR,"WR, MIA: T.Conner (AFC East, ID: 00-0037348)",MIA
WR,"WR, MIA: T.Cracraft (AFC East, ID: 00-0034054)",MIA
WR,"WR, MIA: T.Hill (AFC East, ID: 00-0033040)",MIA
WR,"WR, MIA: T.Sherfield (AFC East, ID: 00-0034487)",MIA
WR,"WR, PHI: A.Brown (NFC East, ID: 00-0035676)",PHI
WR,"WR, PHI: B.Covey (NFC East, ID: 00-0037132)",PHI
WR,"WR, PHI: D.Allen (NFC East, ID: 00-0037039)",PHI
WR,"WR, PHI: D.Cain (NFC East, ID: 00-0034406)",PHI
WR,"WR, PHI: D.Smith (NFC East, ID: 00-0036912)",PHI
WR,"WR, PHI: G.Ward (NFC East, ID: 00-0033733)",PHI
WR,"WR, PHI: K.Wheatfall (NFC East, ID: 00-0037630)",PHI
WR,"WR, PHI: T.Cleveland (NFC East, ID: 00-0036439)",PHI
WR,"WR, PHI: T.Watkins (NFC East, ID: 00-0036271)",PHI
WR,"WR, PHI: Z.Pascal (NFC East, ID: 00-0033251)",PHI
WR,"WR, PIT: A.Miller (AFC North, ID: 00-0034353)",PIT
WR,"WR, PIT: C.Austin (AFC North, ID: 00-0037837)",PIT
WR,"WR, PIT: C.White (AFC North, ID: 00-0035891)",PIT
WR,"WR, PIT: D.Johnson (AFC North, ID: 00-0035216)",PIT
WR,"WR, PIT: G.Pickens (AFC North, ID: 00-0037247)",PIT
WR,"WR, PIT: J.Bradley (AFC North, ID: 00-0036110)",PIT
WR,"WR, PIT: J.Malone (AFC North, ID: 00-0033859)",PIT
WR,"WR, PIT: K.Olszewski (AFC North, ID: 00-0035645)",PIT
WR,"WR, PIT: M.Boykin (AFC North, ID: 00-0035703)",PIT
WR,"WR, PIT: S.Sims (AFC North, ID: 00-0034928)",PIT
WR,"WR, PIT: T.Snead (AFC North, ID: 00-0037646)",PIT
WR,"WR, PIT: T.Vaughns (AFC North, ID: 00-0036495)",PIT
WR,"WR, SF: A.Mack (NFC West, ID: 00-0035869)",SF
WR,"WR, SF: B.Aiyuk (NFC West, ID: 00-0036261)",SF
WR,"WR, SF: B.Jennings (NFC West, ID: 00-0036259)",SF
WR,"WR, SF: D.Gray (NFC West, ID: 00-0037828)",SF
WR,"WR, SF: D.Martin (NFC West, ID: 00-0037524)",SF
WR,"WR, SF: D.Newsome (NFC West, ID: 00-0036907)",SF
WR,"WR, SF: R.McCloud (NFC West, ID: 00-0034407)",SF
WR,"WR, SF: T.Mack (NFC West, ID: 00-0037523)",SF
WR,"WR, SF: T.Samuel (NFC West, ID: 00-0035719)",SF
WR,"WR, SF: T.Sharpe (NFC West, ID: 00-0032778)",SF
WR,"WR, SF: W.Snead (NFC West, ID: 00-0030663)",SF
WR,"WR, TB: B.Perriman (NFC South, ID: 00-0032054)",TB
WR,"WR, TB: D.Thompkins (NFC South, ID: 00-0037487)",TB
WR,"WR, TB: J.Howard (NFC South, ID: 00-0033261)",TB
WR,"WR, TB: K.Brown (NFC South, ID: 00-0037626)",TB
WR,"WR, TB: K.Geiger (NFC South, ID: 00-0037483)",TB
WR,"WR, TB: M.Evans (NFC South, ID: 00-0031408)",TB
WR,"WR, TB: Q.Jones (NFC South, ID: 00-0027944)",TB
WR,"WR, TB: R.Gage (NFC South, ID: 00-0034411)",TB
WR,"WR, TB: R.Godwin (NFC South, ID: 00-0033921)",TB
WR,"WR, TB: S.Miller (NFC South, ID: 00-0035298)",TB
WR,"WR, TB: T.Johnson (NFC South, ID: 00-0036427)",TB
Defense,"Defense, BAL (AFC North)",BAL
Defense,"Defense, BUF (AFC East)",BUF
Defense,"Defense, CLE (AFC North)",CLE
Defense,"Defense, DAL (NFC East)",DAL
Defense,"Defense, DET (NFC North)",DET
Defense,"Defense, GB (NFC North)",GB
Defense,"Defense, HOU (AFC South)",HOU
Defense,"Defense, KC (AFC West)",KC
Defense,"Defense, LA (NFC West)",LA
Defense,"Defense, MIA (AFC East)",MIA
Defense,"Defense, PHI (NFC East)",PHI
Defense,"Defense, PIT (AFC North)",PIT
Defense,"Defense, SF (NFC West)",SF
Defense,"Defense, TB (NFC South)",TB
