team_abbr,position,player_id,player_name,team_conf,team_division,lookup_string
PIT,WR,00-0037837,C.Austin,AFC,AFC North,"WR, PIT: C.Austin (AFC North, ID: 00-0037837)"
PIT,QB,00-0038102,K.Pickett,AFC,AFC North,"QB, PIT: K.Pickett (AFC North, ID: 00-0038102)"
SEA,WR,00-0030068,M.Goodwin,NFC,NFC West,"WR, SEA: M.Goodwin (NFC West, ID: 00-0030068)"
SEA,QB,00-0030565,E.Smith,NFC,NFC West,"QB, SEA: E.Smith (NFC West, ID: 00-0030565)"
SEA,K,00-0031492,J.Myers,NFC,NFC West,"K, SEA: J.Myers (NFC West, ID: 00-0031492)"
SEA,WR,00-0032211,T.Lockett,NFC,NFC West,"WR, SEA: T.Lockett (NFC West, ID: 00-0032211)"
SEA,QB,00-0032245,S.Mannion,NFC,NFC West,"QB, SEA: S.Mannion (NFC West, ID: 00-0032245)"
SEA,WR,00-0032951,L.Treadwell,NFC,NFC West,"WR, SEA: L.Treadwell (NFC West, ID: 00-0032951)"
SEA,TE,00-0033387,J.Hollister,NFC,NFC West,"TE, SEA: J.Hollister (NFC West, ID: 00-0033387)"
SEA,RB,00-0033594,C.Carson,NFC,NFC West,"RB, SEA: C.Carson (NFC West, ID: 00-0033594)"
SEA,RB,00-0033950,W.Gallman,NFC,NFC West,"RB, SEA: W.Gallman (NFC West, ID: 00-0033950)"
SEA,TE,00-0034159,W.Dissly,NFC,NFC West,"TE, SEA: W.Dissly (NFC West, ID: 00-0034159)"
SEA,RB,00-0034614,G.Igwebuike,NFC,NFC West,"RB, SEA: G.Igwebuike (NFC West, ID: 00-0034614)"
SEA,WR,00-0034715,D.Alexander,NFC,NFC West,"WR, SEA: D.Alexander (NFC West, ID: 00-0034715)"
SEA,RB,00-0034750,R.Penny,NFC,NFC West,"RB, SEA: R.Penny (NFC West, ID: 00-0034750)"
SEA,WR,00-0035022,P.Hart,NFC,NFC West,"WR, SEA: P.Hart (NFC West, ID: 00-0035022)"
SEA,WR,00-0035121,J.Smith,NFC,NFC West,"WR, SEA: J.Smith (NFC West, ID: 00-0035121)"
SEA,RB,00-0035148,D.Thompson,NFC,NFC West,"RB, SEA: D.Thompson (NFC West, ID: 00-0035148)"
SEA,WR,00-0035164,C.Thompson,NFC,NFC West,"WR, SEA: C.Thompson (NFC West, ID: 00-0035164)"
SEA,TE,00-0035246,J.Arcega-Whiteside,NFC,NFC West,"TE, SEA: J.Arcega-Whiteside (NFC West, ID: 00-0035246)"
SEA,RB,00-0035304,C.Gillaspia,NFC,NFC West,"RB, SEA: C.Gillaspia (NFC West, ID: 00-0035304)"
SEA,RB,00-0035594,T.Homer,NFC,NFC West,"RB, SEA: T.Homer (NFC West, ID: 00-0035594)"
SEA,WR,00-0035640,D.Metcalf,NFC,NFC West,"WR, SEA: D.Metcalf (NFC West, ID: 00-0035640)"
SEA,TE,00-0035644,N.Fant,NFC,NFC West,"TE, SEA: N.Fant (NFC West, ID: 00-0035644)"
SEA,QB,00-0035704,D.Lock,NFC,NFC West,"QB, SEA: D.Lock (NFC West, ID: 00-0035704)"
SEA,RB,00-0035860,T.Jones,NFC,NFC West,"RB, SEA: T.Jones (NFC West, ID: 00-0035860)"
SEA,WR,00-0035987,A.Fuller,NFC,NFC West,"WR, SEA: A.Fuller (NFC West, ID: 00-0035987)"
SEA,TE,00-0036059,T.Mabry,NFC,NFC West,"TE, SEA: T.Mabry (NFC West, ID: 00-0036059)"
SEA,WR,00-0036080,E.Winston,NFC,NFC West,"WR, SEA: E.Winston (NFC West, ID: 00-0036080)"
SEA,TE,00-0036244,C.Parkinson,NFC,NFC West,"TE, SEA: C.Parkinson (NFC West, ID: 00-0036244)"
SEA,RB,00-0036425,D.Dallas,NFC,NFC West,"RB, SEA: D.Dallas (NFC West, ID: 00-0036425)"
SEA,WR,00-0036620,D.Eskridge,NFC,NFC West,"WR, SEA: D.Eskridge (NFC West, ID: 00-0036620)"
SEA,RB,00-0036799,J.Johnson,NFC,NFC West,"RB, SEA: J.Johnson (NFC West, ID: 00-0036799)"
SEA,WR,00-0036804,C.Wedington,NFC,NFC West,"WR, SEA: C.Wedington (NFC West, ID: 00-0036804)"
SEA,WR,00-0036810,C.Johnson,NFC,NFC West,"WR, SEA: C.Johnson (NFC West, ID: 00-0036810)"
SEA,WR,00-0037093,D.Young,NFC,NFC West,"WR, SEA: D.Young (NFC West, ID: 00-0037093)"
SEA,TE,00-0037143,C.Brewer,NFC,NFC West,"TE, SEA: C.Brewer (NFC West, ID: 00-0037143)"
SEA,WR,00-0037501,K.Kassis,NFC,NFC West,"WR, SEA: K.Kassis (NFC West, ID: 00-0037501)"
SEA,RB,00-0038134,K.Walker,NFC,NFC West,"RB, SEA: K.Walker (NFC West, ID: 00-0038134)"
SF,K,00-0023252,R.Gould,NFC,NFC West,"K, SF: R.Gould (NFC West, ID: 00-0023252)"
SF,RB,00-0023500,F.Gore,NFC,NFC West,"RB, SF: F.Gore (NFC West, ID: 00-0023500)"
SF,QB,00-0026300,J.Johnson,NFC,NFC West,"QB, SF: J.Johnson (NFC West, ID: 00-0026300)"
SF,RB,00-0029892,K.Juszczyk,NFC,NFC West,"RB, SF: K.Juszczyk (NFC West, ID: 00-0029892)"
SF,WR,00-0030663,W.Snead,NFC,NFC West,"WR, SF: W.Snead (NFC West, ID: 00-0030663)"
SF,TE,00-0031299,J.Matthews,NFC,NFC West,"TE, SF: J.Matthews (NFC West, ID: 00-0031299)"
SF,QB,00-0031345,J.Garoppolo,NFC,NFC West,"QB, SF: J.Garoppolo (NFC West, ID: 00-0031345)"
SF,RB,00-0032058,T.Coleman,NFC,NFC West,"RB, SF: T.Coleman (NFC West, ID: 00-0032058)"
SF,TE,00-0032214,T.Kroft,NFC,NFC West,"TE, SF: T.Kroft (NFC West, ID: 00-0032214)"
SF,WR,00-0032778,T.Sharpe,NFC,NFC West,"WR, SF: T.Sharpe (NFC West, ID: 00-0032778)"
SF,RB,00-0033280,C.McCaffrey,NFC,NFC West,"RB, SF: C.McCaffrey (NFC West, ID: 00-0033280)"
SF,TE,00-0033288,G.Kittle,NFC,NFC West,"TE, SF: G.Kittle (NFC West, ID: 00-0033288)"
SF,TE,00-0034073,R.Dwelley,NFC,NFC West,"TE, SF: R.Dwelley (NFC West, ID: 00-0034073)"
SF,QB,00-0034131,K.Benkert,NFC,NFC West,"QB, SF: K.Benkert (NFC West, ID: 00-0034131)"
SF,TE,00-0034393,T.Fumagalli,NFC,NFC West,"TE, SF: T.Fumagalli (NFC West, ID: 00-0034393)"
SF,WR,00-0034407,R.McCloud,NFC,NFC West,"WR, SF: R.McCloud (NFC West, ID: 00-0034407)"
SF,WR,00-0035719,T.Samuel,NFC,NFC West,"WR, SF: T.Samuel (NFC West, ID: 00-0035719)"
SF,RB,00-0035807,J.Hokit,NFC,NFC West,"RB, SF: J.Hokit (NFC West, ID: 00-0035807)"
SF,WR,00-0035869,A.Mack,NFC,NFC West,"WR, SF: A.Mack (NFC West, ID: 00-0035869)"
SF,QB,00-0036226,J.Eason,NFC,NFC West,"QB, SF: J.Eason (NFC West, ID: 00-0036226)"
SF,WR,00-0036259,B.Jennings,NFC,NFC West,"WR, SF: B.Jennings (NFC West, ID: 00-0036259)"
SF,WR,00-0036261,B.Aiyuk,NFC,NFC West,"WR, SF: B.Aiyuk (NFC West, ID: 00-0036261)"
SF,TE,00-0036429,C.Woerner,NFC,NFC West,"TE, SF: C.Woerner (NFC West, ID: 00-0036429)"
SF,K,00-0036436,S.Sloman,NFC,NFC West,"K, SF: S.Sloman (NFC West, ID: 00-0036436)"
SF,RB,00-0036567,E.Mitchell,NFC,NFC West,"RB, SF: E.Mitchell (NFC West, ID: 00-0036567)"
SF,WR,00-0036907,D.Newsome,NFC,NFC West,"WR, SF: D.Newsome (NFC West, ID: 00-0036907)"
SF,QB,00-0037012,T.Lance,NFC,NFC West,"QB, SF: T.Lance (NFC West, ID: 00-0037012)"
SF,WR,00-0037523,T.Mack,NFC,NFC West,"WR, SF: T.Mack (NFC West, ID: 00-0037523)"
SF,WR,00-0037524,D.Martin,NFC,NFC West,"WR, SF: D.Martin (NFC West, ID: 00-0037524)"
SF,RB,00-0037525,J.Mason,NFC,NFC West,"RB, SF: J.Mason (NFC West, ID: 00-0037525)"
SF,RB,00-0037827,T.Davis-Price,NFC,NFC West,"RB, SF: T.Davis-Price (NFC West, ID: 00-0037827)"
SF,WR,00-0037828,D.Gray,NFC,NFC West,"WR, SF: D.Gray (NFC West, ID: 00-0037828)"
SF,QB,00-0037834,B.Purdy,NFC,NFC West,"QB, SF: B.Purdy (NFC West, ID: 00-0037834)"
TB,QB,00-0019596,T.Brady,NFC,NFC South,"QB, TB: T.Brady (NFC South, ID: 00-0019596)"
TB,K,00-0026968,R.Succop,NFC,NFC South,"K, TB: R.Succop (NFC South, ID: 00-0026968)"
TB,WR,00-0027944,Q.Jones,NFC,NFC South,"WR, TB: Q.Jones (NFC South, ID: 00-0027944)"
TB,QB,00-0027948,B.Gabbert,NFC,NFC South,"QB, TB: B.Gabbert (NFC South, ID: 00-0027948)"
TB,TE,00-0027981,K.Rudolph,NFC,NFC South,"TE, TB: K.Rudolph (NFC South, ID: 00-0027981)"
TB,QB,00-0029857,R.Griffin,NFC,NFC South,"QB, TB: R.Griffin (NFC South, ID: 00-0029857)"
TB,RB,00-0030456,G.Bernard,NFC,NFC South,"RB, TB: G.Bernard (NFC South, ID: 00-0030456)"
TB,RB,00-0030465,K.Barner,NFC,NFC South,"RB, TB: K.Barner (NFC South, ID: 00-0030465)"
TB,TE,00-0031273,C.Brate,NFC,NFC South,"TE, TB: C.Brate (NFC South, ID: 00-0031273)"
TB,WR,00-0031408,M.Evans,NFC,NFC South,"WR, TB: M.Evans (NFC South, ID: 00-0031408)"
TB,WR,00-0032054,B.Perriman,NFC,NFC South,"WR, TB: B.Perriman (NFC South, ID: 00-0032054)"
TB,WR,00-0033261,J.Howard,NFC,NFC South,"WR, TB: J.Howard (NFC South, ID: 00-0033261)"
TB,RB,00-0033856,L.Fournette,NFC,NFC South,"RB, TB: L.Fournette (NFC South, ID: 00-0033856)"
TB,WR,00-0033921,R.Godwin,NFC,NFC South,"WR, TB: R.Godwin (NFC South, ID: 00-0033921)"
TB,WR,00-0034411,R.Gage,NFC,NFC South,"WR, TB: R.Gage (NFC South, ID: 00-0034411)"
TB,TE,00-0034575,D.Wells,NFC,NFC South,"TE, TB: D.Wells (NFC South, ID: 00-0034575)"
TB,TE,00-0034735,C.McElroy,NFC,NFC South,"TE, TB: C.McElroy (NFC South, ID: 00-0034735)"
TB,WR,00-0035298,S.Miller,NFC,NFC South,"WR, TB: S.Miller (NFC South, ID: 00-0035298)"
TB,RB,00-0035342,P.Laird,NFC,NFC South,"RB, TB: P.Laird (NFC South, ID: 00-0035342)"
TB,WR,00-0036427,T.Johnson,NFC,NFC South,"WR, TB: T.Johnson (NFC South, ID: 00-0036427)"
TB,RB,00-0036450,K.Vaughn,NFC,NFC South,"RB, TB: K.Vaughn (NFC South, ID: 00-0036450)"
TB,K,00-0036757,J.Borregales,NFC,NFC South,"K, TB: J.Borregales (NFC South, ID: 00-0036757)"
TB,QB,00-0036928,K.Trask,NFC,NFC South,"QB, TB: K.Trask (NFC South, ID: 00-0036928)"
TB,RB,00-0037256,R.White,NFC,NFC South,"RB, TB: R.White (NFC South, ID: 00-0037256)"
TB,TE,00-0037311,K.Kieft,NFC,NFC South,"TE, TB: K.Kieft (NFC South, ID: 00-0037311)"
TB,WR,00-0037483,K.Geiger,NFC,NFC South,"WR, TB: K.Geiger (NFC South, ID: 00-0037483)"
TB,WR,00-0037487,D.Thompkins,NFC,NFC South,"WR, TB: D.Thompkins (NFC South, ID: 00-0037487)"
TB,TE,00-0037490,B.Beise,NFC,NFC South,"TE, TB: B.Beise (NFC South, ID: 00-0037490)"
TB,WR,00-0037626,K.Brown,NFC,NFC South,"WR, TB: K.Brown (NFC South, ID: 00-0037626)"
TB,TE,00-0037631,J.Howland,NFC,NFC South,"TE, TB: J.Howland (NFC South, ID: 00-0037631)"
TB,TE,00-0038129,C.Otton,NFC,NFC South,"TE, TB: C.Otton (NFC South, ID: 00-0038129)"
TEN,K,00-0029421,R.Bullock,AFC,AFC South,"K, TEN: R.Bullock (AFC South, ID: 00-0029421)"
TEN,WR,00-0029664,J.Gordon,AFC,AFC South,"WR, TEN: J.Gordon (AFC South, ID: 00-0029664)"
TEN,QB,00-0029701,R.Tannehill,AFC,AFC South,"QB, TEN: R.Tannehill (AFC South, ID: 00-0029701)"
TEN,WR,00-0030431,R.Woods,AFC,AFC South,"WR, TEN: R.Woods (AFC South, ID: 00-0030431)"
TEN,K,00-0032087,J.Lambo,AFC,AFC South,"K, TEN: J.Lambo (AFC South, ID: 00-0032087)"
TEN,WR,00-0032128,C.Conley,AFC,AFC South,"WR, TEN: C.Conley (AFC South, ID: 00-0032128)"
TEN,TE,00-0032141,G.Swaim,AFC,AFC South,"TE, TEN: G.Swaim (AFC South, ID: 00-0032141)"
TEN,TE,00-0032392,A.Hooper,AFC,AFC South,"TE, TEN: A.Hooper (AFC South, ID: 00-0032392)"
TEN,RB,00-0032764,D.Henry,AFC,AFC South,"RB, TEN: D.Henry (AFC South, ID: 00-0032764)"
TEN,QB,00-0032784,K.Hogan,AFC,AFC South,"QB, TEN: K.Hogan (AFC South, ID: 00-0032784)"
TEN,WR,00-0033367,C.Board,AFC,AFC South,"WR, TEN: C.Board (AFC South, ID: 00-0033367)"
TEN,WR,00-0033386,C.Hollister,AFC,AFC South,"WR, TEN: C.Hollister (AFC South, ID: 00-0033386)"
TEN,TE,00-0033421,A.Auclair,AFC,AFC South,"TE, TEN: A.Auclair (AFC South, ID: 00-0033421)"
TEN,QB,00-0033949,R.Dobbs,AFC,AFC South,"QB, TEN: R.Dobbs (AFC South, ID: 00-0033949)"
TEN,RB,00-0034164,T.Cannon,AFC,AFC South,"RB, TEN: T.Cannon (AFC South, ID: 00-0034164)"
TEN,TE,00-0034193,K.Rader,AFC,AFC South,"TE, TEN: K.Rader (AFC South, ID: 00-0034193)"
TEN,RB,00-0034253,D.Hilliard,AFC,AFC South,"RB, TEN: D.Hilliard (AFC South, ID: 00-0034253)"
TEN,WR,00-0035782,J.Green,AFC,AFC South,"WR, TEN: J.Green (AFC South, ID: 00-0035782)"
TEN,RB,00-0035924,J.Ward,AFC,AFC South,"RB, TEN: J.Ward (AFC South, ID: 00-0035924)"
TEN,TE,00-0036173,T.Hudson,AFC,AFC South,"TE, TEN: T.Hudson (AFC South, ID: 00-0036173)"
TEN,WR,00-0036176,M.Kinsey,AFC,AFC South,"WR, TEN: M.Kinsey (AFC South, ID: 00-0036176)"
TEN,WR,00-0036182,N.Westbrook-Ikhine,AFC,AFC South,"WR, TEN: N.Westbrook-Ikhine (AFC South, ID: 00-0036182)"
TEN,WR,00-0036627,D.Fitzpatrick,AFC,AFC South,"WR, TEN: D.Fitzpatrick (AFC South, ID: 00-0036627)"
TEN,WR,00-0036652,R.McMath,AFC,AFC South,"WR, TEN: R.McMath (AFC South, ID: 00-0036652)"
TEN,RB,00-0036691,T.Carter,AFC,AFC South,"RB, TEN: T.Carter (AFC South, ID: 00-0036691)"
TEN,TE,00-0036696,B.Moore,AFC,AFC South,"TE, TEN: B.Moore (AFC South, ID: 00-0036696)"
TEN,WR,00-0037273,K.Philips,AFC,AFC South,"WR, TEN: K.Philips (AFC South, ID: 00-0037273)"
TEN,RB,00-0037594,J.Chestnut,AFC,AFC South,"RB, TEN: J.Chestnut (AFC South, ID: 00-0037594)"
TEN,WR,00-0037599,B.Lewis,AFC,AFC South,"WR, TEN: B.Lewis (AFC South, ID: 00-0037599)"
TEN,WR,00-0037604,R.Roberson,AFC,AFC South,"WR, TEN: R.Roberson (AFC South, ID: 00-0037604)"
TEN,K,00-0037606,C.Shudak,AFC,AFC South,"K, TEN: C.Shudak (AFC South, ID: 00-0037606)"
TEN,RB,00-0037617,H.Haskins,AFC,AFC South,"RB, TEN: H.Haskins (AFC South, ID: 00-0037617)"
TEN,WR,00-0037742,T.Burks,AFC,AFC South,"WR, TEN: T.Burks (AFC South, ID: 00-0037742)"
TEN,TE,00-0037809,C.Okonkwo,AFC,AFC South,"TE, TEN: C.Okonkwo (AFC South, ID: 00-0037809)"
TEN,QB,00-0038128,M.Willis,AFC,AFC South,"QB, TEN: M.Willis (AFC South, ID: 00-0038128)"
TEN,TE,00-0038145,T.Odukoya,AFC,AFC South,"TE, TEN: T.Odukoya (AFC South, ID: 00-0038145)"
WAS,TE,00-0031260,L.Thomas,NFC,NFC East,"TE, WAS: L.Thomas (NFC East, ID: 00-0031260)"
WAS,QB,00-0031800,T.Heinicke,NFC,NFC East,"QB, WAS: T.Heinicke (NFC East, ID: 00-0031800)"
WAS,WR,00-0032543,A.Erickson,NFC,NFC East,"WR, WAS: A.Erickson (NFC East, ID: 00-0032543)"
WAS,RB,00-0032602,J.McKissic,NFC,NFC East,"RB, WAS: J.McKissic (NFC East, ID: 00-0032602)"
WAS,WR,00-0032609,M.Michel,NFC,NFC East,"WR, WAS: M.Michel (NFC East, ID: 00-0032609)"
WAS,QB,00-0032950,C.Wentz,NFC,NFC East,"QB, WAS: C.Wentz (NFC East, ID: 00-0032950)"
WAS,RB,00-0032975,J.Williams,NFC,NFC East,"RB, WAS: J.Williams (NFC East, ID: 00-0032975)"
WAS,WR,00-0033282,C.Samuel,NFC,NFC East,"WR, WAS: C.Samuel (NFC East, ID: 00-0033282)"
WAS,RB,00-0033296,A.Armah,NFC,NFC East,"RB, WAS: A.Armah (NFC East, ID: 00-0033296)"
WAS,WR,00-0034104,C.Sims,NFC,NFC East,"WR, WAS: C.Sims (NFC East, ID: 00-0034104)"
WAS,RB,00-0034578,R.Bonnafon,NFC,NFC East,"RB, WAS: R.Bonnafon (NFC East, ID: 00-0034578)"
WAS,K,00-0035192,J.Slye,NFC,NFC East,"K, WAS: J.Slye (NFC East, ID: 00-0035192)"
WAS,WR,00-0035297,K.Harmon,NFC,NFC East,"WR, WAS: K.Harmon (NFC East, ID: 00-0035297)"
WAS,WR,00-0035659,T.McLaurin,NFC,NFC East,"WR, WAS: T.McLaurin (NFC East, ID: 00-0035659)"
WAS,WR,00-0035838,M.Cole,NFC,NFC East,"WR, WAS: M.Cole (NFC East, ID: 00-0035838)"
WAS,TE,00-0036129,E.Wolf,NFC,NFC East,"TE, WAS: E.Wolf (NFC East, ID: 00-0036129)"
WAS,QB,00-0036197,W.Fromm,NFC,NFC East,"QB, WAS: W.Fromm (NFC East, ID: 00-0036197)"
WAS,RB,00-0036328,A.Gibson,NFC,NFC East,"RB, WAS: A.Gibson (NFC East, ID: 00-0036328)"
WAS,WR,00-0036340,A.Gandy-Golden,NFC,NFC East,"WR, WAS: A.Gandy-Golden (NFC East, ID: 00-0036340)"
WAS,WR,00-0036626,D.Brown,NFC,NFC East,"WR, WAS: D.Brown (NFC East, ID: 00-0036626)"
WAS,TE,00-0036628,J.Bates,NFC,NFC East,"TE, WAS: J.Bates (NFC East, ID: 00-0036628)"
WAS,WR,00-0036671,D.Milne,NFC,NFC East,"WR, WAS: D.Milne (NFC East, ID: 00-0036671)"
WAS,K,00-0036703,B.Johnson,NFC,NFC East,"K, WAS: B.Johnson (NFC East, ID: 00-0036703)"
WAS,TE,00-0036746,J.Hausmann,NFC,NFC East,"TE, WAS: J.Hausmann (NFC East, ID: 00-0036746)"
WAS,RB,00-0036755,J.Patterson,NFC,NFC East,"RB, WAS: J.Patterson (NFC East, ID: 00-0036755)"
WAS,QB,00-0037077,S.Howell,NFC,NFC East,"QB, WAS: S.Howell (NFC East, ID: 00-0037077)"
WAS,TE,00-0037078,C.Turner,NFC,NFC East,"TE, WAS: C.Turner (NFC East, ID: 00-0037078)"
WAS,WR,00-0037162,J.Ezzard,NFC,NFC East,"WR, WAS: J.Ezzard (NFC East, ID: 00-0037162)"
WAS,TE,00-0037164,C.Hodges,NFC,NFC East,"TE, WAS: C.Hodges (NFC East, ID: 00-0037164)"
WAS,QB,00-0037165,C.Kelley,NFC,NFC East,"QB, WAS: C.Kelley (NFC East, ID: 00-0037165)"
WAS,TE,00-0037168,A.Rogers,NFC,NFC East,"TE, WAS: A.Rogers (NFC East, ID: 00-0037168)"
WAS,WR,00-0037172,K.Mcgowan,NFC,NFC East,"WR, WAS: K.Mcgowan (NFC East, ID: 00-0037172)"
WAS,WR,00-0037741,J.Dotson,NFC,NFC East,"WR, WAS: J.Dotson (NFC East, ID: 00-0037741)"
WAS,RB,00-0037746,B.Robinson,NFC,NFC East,"RB, WAS: B.Robinson (NFC East, ID: 00-0037746)"
