team_abbr,position,player_id,player_name,team_conf,team_division,lookup_string
DEN,RB,00-0033951,M.Mack,AFC,AFC West,"RB, DEN: M.Mack (AFC West, ID: 00-0033951)"
DEN,RB,00-0034208,M.Boone,AFC,AFC West,"RB, DEN: M.Boone (AFC West, ID: 00-0034208)"
DEN,WR,00-0034339,D.Quinn,AFC,AFC West,"WR, DEN: D.Quinn (AFC West, ID: 00-0034339)"
DEN,WR,00-0034348,C.Sutton,AFC,AFC West,"WR, DEN: C.Sutton (AFC West, ID: 00-0034348)"
DEN,RB,00-0034681,C.Edmonds,AFC,AFC West,"RB, DEN: C.Edmonds (AFC West, ID: 00-0034681)"
DEN,QB,00-0034955,B.Rypien,AFC,AFC West,"QB, DEN: B.Rypien (AFC West, ID: 00-0034955)"
DEN,TE,00-0034959,A.Beck,AFC,AFC West,"TE, DEN: A.Beck (AFC West, ID: 00-0034959)"
DEN,WR,00-0035181,D.Shepherd,AFC,AFC West,"WR, DEN: D.Shepherd (AFC West, ID: 00-0035181)"
DEN,RB,00-0035184,D.Ozigbo,AFC,AFC West,"RB, DEN: D.Ozigbo (AFC West, ID: 00-0035184)"
DEN,RB,00-0035448,D.Crockett,AFC,AFC West,"RB, DEN: D.Crockett (AFC West, ID: 00-0035448)"
DEN,WR,00-0035864,K.Hinton,AFC,AFC West,"WR, DEN: K.Hinton (AFC West, ID: 00-0035864)"
DEN,WR,00-0036247,F.Swain,AFC,AFC West,"WR, DEN: F.Swain (AFC West, ID: 00-0036247)"
DEN,WR,00-0036407,J.Jeudy,AFC,AFC West,"WR, DEN: J.Jeudy (AFC West, ID: 00-0036407)"
DEN,WR,00-0036412,K.Hamler,AFC,AFC West,"WR, DEN: K.Hamler (AFC West, ID: 00-0036412)"
DEN,TE,00-0036423,A.Okwuegbunam,AFC,AFC West,"TE, DEN: A.Okwuegbunam (AFC West, ID: 00-0036423)"
DEN,RB,00-0036768,J.Hardy,AFC,AFC West,"RB, DEN: J.Hardy (AFC West, ID: 00-0036768)"
DEN,RB,00-0036997,J.Williams,AFC,AFC West,"RB, DEN: J.Williams (AFC West, ID: 00-0036997)"
DEN,RB,00-0037085,T.Badie,AFC,AFC West,"RB, DEN: T.Badie (AFC West, ID: 00-0037085)"
DEN,TE,00-0037252,G.Dulcich,AFC,AFC West,"TE, DEN: G.Dulcich (AFC West, ID: 00-0037252)"
DEN,WR,00-0037272,M.Washington,AFC,AFC West,"WR, DEN: M.Washington (AFC West, ID: 00-0037272)"
DEN,WR,00-0037380,K.Davis,AFC,AFC West,"WR, DEN: K.Davis (AFC West, ID: 00-0037380)"
DEN,WR,00-0037382,B.Johnson,AFC,AFC West,"WR, DEN: B.Johnson (AFC West, ID: 00-0037382)"
DEN,TE,00-0037386,D.Parham,AFC,AFC West,"TE, DEN: D.Parham (AFC West, ID: 00-0037386)"
DEN,WR,00-0037387,J.Virgil,AFC,AFC West,"WR, DEN: J.Virgil (AFC West, ID: 00-0037387)"
DEN,RB,00-0037450,T.McAllister,AFC,AFC West,"RB, DEN: T.McAllister (AFC West, ID: 00-0037450)"
DEN,QB,00-0037650,J.Guarantano,AFC,AFC West,"QB, DEN: J.Guarantano (AFC West, ID: 00-0037650)"
DET,TE,00-0032055,D.Funchess,NFC,NFC North,"TE, DET: D.Funchess (NFC North, ID: 00-0032055)"
DET,WR,00-0032464,K.Raymond,NFC,NFC North,"WR, DET: K.Raymond (NFC North, ID: 00-0032464)"
DET,QB,00-0032792,N.Sudfeld,NFC,NFC North,"QB, DET: N.Sudfeld (NFC North, ID: 00-0032792)"
DET,K,00-0032870,A.Rosas,NFC,NFC North,"K, DET: A.Rosas (NFC North, ID: 00-0032870)"
DET,TE,00-0033095,G.Griffin,NFC,NFC North,"TE, DET: G.Griffin (NFC North, ID: 00-0033095)"
DET,QB,00-0033106,J.Goff,NFC,NFC North,"QB, DET: J.Goff (NFC North, ID: 00-0033106)"
DET,K,00-0033138,S.Ficken,NFC,NFC North,"K, DET: S.Ficken (NFC North, ID: 00-0033138)"
DET,WR,00-0033943,J.Reynolds,NFC,NFC North,"WR, DET: J.Reynolds (NFC North, ID: 00-0033943)"
DET,RB,00-0033948,J.Williams,NFC,NFC North,"RB, DET: J.Williams (NFC North, ID: 00-0033948)"
DET,WR,00-0034052,B.Zylstra,NFC,NFC North,"WR, DET: B.Zylstra (NFC North, ID: 00-0034052)"
DET,K,00-0034084,M.Badgley,NFC,NFC North,"K, DET: M.Badgley (NFC North, ID: 00-0034084)"
DET,RB,00-0034171,J.Cabinda,NFC,NFC North,"RB, DET: J.Cabinda (NFC North, ID: 00-0034171)"
DET,RB,00-0034440,J.Jackson,NFC,NFC North,"RB, DET: J.Jackson (NFC North, ID: 00-0034440)"
DET,WR,00-0034777,D.Chark,NFC,NFC North,"WR, DET: D.Chark (NFC North, ID: 00-0034777)"
DET,WR,00-0034930,T.Benson,NFC,NFC North,"WR, DET: T.Benson (NFC North, ID: 00-0034930)"
DET,K,00-0035145,A.Seibert,NFC,NFC North,"K, DET: A.Seibert (NFC North, ID: 00-0035145)"
DET,WR,00-0035544,T.Kennedy,NFC,NFC North,"WR, DET: T.Kennedy (NFC North, ID: 00-0035544)"
DET,RB,00-0035567,C.Reynolds,NFC,NFC North,"RB, DET: C.Reynolds (NFC North, ID: 00-0035567)"
DET,QB,00-0036022,S.Montez,NFC,NFC North,"QB, DET: S.Montez (NFC North, ID: 00-0036022)"
DET,K,00-0036168,D.Eberle,NFC,NFC North,"K, DET: D.Eberle (NFC North, ID: 00-0036168)"
DET,RB,00-0036275,D.Swift,NFC,NFC North,"RB, DET: D.Swift (NFC North, ID: 00-0036275)"
DET,WR,00-0036277,Q.Cephus,NFC,NFC North,"WR, DET: Q.Cephus (NFC North, ID: 00-0036277)"
DET,TE,00-0036534,S.Zylstra,NFC,NFC North,"TE, DET: S.Zylstra (NFC North, ID: 00-0036534)"
DET,RB,00-0036670,J.Jefferson,NFC,NFC North,"RB, DET: J.Jefferson (NFC North, ID: 00-0036670)"
DET,TE,00-0036754,B.Wright,NFC,NFC North,"TE, DET: B.Wright (NFC North, ID: 00-0036754)"
DET,WR,00-0036963,A.St. Brown,NFC,NFC North,"WR, DET: A.St. Brown (NFC North, ID: 00-0036963)"
DET,WR,00-0037240,J.Williams,NFC,NFC North,"WR, DET: J.Williams (NFC North, ID: 00-0037240)"
DET,TE,00-0037282,J.Mitchell,NFC,NFC North,"TE, DET: J.Mitchell (NFC North, ID: 00-0037282)"
DET,RB,00-0037437,G.Bell,NFC,NFC North,"RB, DET: G.Bell (NFC North, ID: 00-0037437)"
DET,TE,00-0037439,D.Deese,NFC,NFC North,"TE, DET: D.Deese (NFC North, ID: 00-0037439)"
DET,WR,00-0037442,J.Johnson,NFC,NFC North,"WR, DET: J.Johnson (NFC North, ID: 00-0037442)"
DET,WR,00-0037444,C.Sutton,NFC,NFC North,"WR, DET: C.Sutton (NFC North, ID: 00-0037444)"
DET,TE,00-0037462,N.Givan,NFC,NFC North,"TE, DET: N.Givan (NFC North, ID: 00-0037462)"
DET,WR,00-0037581,S.Berryhill,NFC,NFC North,"WR, DET: S.Berryhill (NFC North, ID: 00-0037581)"
DET,WR,00-0037708,M.Alexander,NFC,NFC North,"WR, DET: M.Alexander (NFC North, ID: 00-0037708)"
GB,QB,00-0023459,A.Rodgers,NFC,NFC North,"QB, GB: A.Rodgers (NFC North, ID: 00-0023459)"
GB,TE,00-0024243,M.Lewis,NFC,NFC North,"TE, GB: M.Lewis (NFC North, ID: 00-0024243)"
GB,K,00-0025580,M.Crosby,NFC,NFC North,"K, GB: M.Crosby (NFC North, ID: 00-0025580)"
GB,WR,00-0028002,R.Cobb,NFC,NFC North,"WR, GB: R.Cobb (NFC North, ID: 00-0028002)"
GB,RB,00-0033293,A.Jones,NFC,NFC North,"RB, GB: A.Jones (NFC North, ID: 00-0033293)"
GB,TE,00-0033757,R.Tonyan,NFC,NFC North,"TE, GB: R.Tonyan (NFC North, ID: 00-0033757)"
GB,WR,00-0033839,D.Westbrook,NFC,NFC North,"WR, GB: D.Westbrook (NFC North, ID: 00-0033839)"
GB,QB,00-0034423,D.Etling,NFC,NFC North,"QB, GB: D.Etling (NFC North, ID: 00-0034423)"
GB,WR,00-0034521,A.Lazard,NFC,NFC North,"WR, GB: A.Lazard (NFC North, ID: 00-0034521)"
GB,WR,00-0034660,R.Gafford,NFC,NFC North,"WR, GB: R.Gafford (NFC North, ID: 00-0034660)"
GB,WR,00-0034922,I.Hyman,NFC,NFC North,"WR, GB: I.Hyman (NFC North, ID: 00-0034922)"
GB,RB,00-0034995,D.Williams,NFC,NFC North,"RB, GB: D.Williams (NFC North, ID: 00-0034995)"
GB,TE,00-0035309,A.Mack,NFC,NFC North,"TE, GB: A.Mack (NFC North, ID: 00-0035309)"
GB,TE,00-0035322,N.Becker,NFC,NFC North,"TE, GB: N.Becker (NFC North, ID: 00-0035322)"
GB,WR,00-0035592,T.Fulgham,NFC,NFC North,"WR, GB: T.Fulgham (NFC North, ID: 00-0035592)"
GB,WR,00-0035593,J.Winfree,NFC,NFC North,"WR, GB: J.Winfree (NFC North, ID: 00-0035593)"
GB,K,00-0035761,R.Ahmed,NFC,NFC North,"K, GB: R.Ahmed (NFC North, ID: 00-0035761)"
GB,WR,00-0035901,J.Cotton,NFC,NFC North,"WR, GB: J.Cotton (NFC North, ID: 00-0035901)"
GB,RB,00-0035973,P.Taylor,NFC,NFC North,"RB, GB: P.Taylor (NFC North, ID: 00-0035973)"
GB,TE,00-0036250,T.Davis,NFC,NFC North,"TE, GB: T.Davis (NFC North, ID: 00-0036250)"
GB,QB,00-0036264,J.Love,NFC,NFC North,"QB, GB: J.Love (NFC North, ID: 00-0036264)"
GB,RB,00-0036265,A.Dillon,NFC,NFC North,"RB, GB: A.Dillon (NFC North, ID: 00-0036265)"
GB,TE,00-0036332,J.Deguara,NFC,NFC North,"TE, GB: J.Deguara (NFC North, ID: 00-0036332)"
GB,K,00-0036469,M.Ammendola,NFC,NFC North,"K, GB: M.Ammendola (NFC North, ID: 00-0036469)"
GB,TE,00-0036489,N.Guggemos,NFC,NFC North,"TE, GB: N.Guggemos (NFC North, ID: 00-0036489)"
GB,RB,00-0036669,K.Hill,NFC,NFC North,"RB, GB: K.Hill (NFC North, ID: 00-0036669)"
GB,TE,00-0036718,S.Beyer,NFC,NFC North,"TE, GB: S.Beyer (NFC North, ID: 00-0036718)"
GB,WR,00-0036773,O.Mitchell,NFC,NFC North,"WR, GB: O.Mitchell (NFC North, ID: 00-0036773)"
GB,TE,00-0037015,S.Cannella,NFC,NFC North,"TE, GB: S.Cannella (NFC North, ID: 00-0037015)"
GB,WR,00-0037091,B.Melton,NFC,NFC North,"WR, GB: B.Melton (NFC North, ID: 00-0037091)"
GB,WR,00-0037098,S.Toure,NFC,NFC North,"WR, GB: S.Toure (NFC North, ID: 00-0037098)"
GB,WR,00-0037119,D.Davis,NFC,NFC North,"WR, GB: D.Davis (NFC North, ID: 00-0037119)"
GB,RB,00-0037120,T.Goodson,NFC,NFC North,"RB, GB: T.Goodson (NFC North, ID: 00-0037120)"
GB,TE,00-0037359,J.Babicz,NFC,NFC North,"TE, GB: J.Babicz (NFC North, ID: 00-0037359)"
GB,TE,00-0037369,A.Allen,NFC,NFC North,"TE, GB: A.Allen (NFC North, ID: 00-0037369)"
GB,K,00-0037492,G.Brkic,NFC,NFC North,"K, GB: G.Brkic (NFC North, ID: 00-0037492)"
GB,WR,00-0037816,R.Doubs,NFC,NFC North,"WR, GB: R.Doubs (NFC North, ID: 00-0037816)"
GB,WR,00-0038124,C.Watson,NFC,NFC North,"WR, GB: C.Watson (NFC North, ID: 00-0038124)"
HOU,RB,00-0030288,M.Burkhead,AFC,AFC South,"RB, HOU: M.Burkhead (AFC South, ID: 00-0030288)"
HOU,WR,00-0031236,B.Cooks,AFC,AFC South,"WR, HOU: B.Cooks (AFC South, ID: 00-0031236)"
HOU,WR,00-0032208,P.Dorsett,AFC,AFC South,"WR, HOU: P.Dorsett (AFC South, ID: 00-0032208)"
HOU,WR,00-0032398,C.Moore,AFC,AFC South,"WR, HOU: C.Moore (AFC South, ID: 00-0032398)"
HOU,QB,00-0032436,J.Driskel,AFC,AFC South,"QB, HOU: J.Driskel (AFC South, ID: 00-0032436)"
HOU,K,00-0032726,J.Fairbairn,AFC,AFC South,"K, HOU: J.Fairbairn (AFC South, ID: 00-0032726)"
HOU,RB,00-0032956,A.Janovich,AFC,AFC South,"RB, HOU: A.Janovich (AFC South, ID: 00-0032956)"
HOU,TE,00-0033798,M.Schreck,AFC,AFC South,"TE, HOU: M.Schreck (AFC South, ID: 00-0033798)"
HOU,RB,00-0033854,O.Ogunbowale,AFC,AFC South,"RB, HOU: O.Ogunbowale (AFC South, ID: 00-0033854)"
HOU,TE,00-0033879,O.Howard,AFC,AFC South,"TE, HOU: O.Howard (AFC South, ID: 00-0033879)"
HOU,WR,00-0034309,C.Beebe,AFC,AFC South,"WR, HOU: C.Beebe (AFC South, ID: 00-0034309)"
HOU,TE,00-0034364,J.Akins,AFC,AFC South,"TE, HOU: J.Akins (AFC South, ID: 00-0034364)"
HOU,QB,00-0034577,K.Allen,AFC,AFC South,"QB, HOU: K.Allen (AFC South, ID: 00-0034577)"
HOU,RB,00-0034838,R.Freeman,AFC,AFC South,"RB, HOU: R.Freeman (AFC South, ID: 00-0034838)"
HOU,WR,00-0034867,M.Turner,AFC,AFC South,"WR, HOU: M.Turner (AFC South, ID: 00-0034867)"
HOU,WR,00-0035045,D.Montgomery,AFC,AFC South,"WR, HOU: D.Montgomery (AFC South, ID: 00-0035045)"
HOU,WR,00-0035101,D.Davis,AFC,AFC South,"WR, HOU: D.Davis (AFC South, ID: 00-0035101)"
HOU,WR,00-0035602,A.Bachman,AFC,AFC South,"WR, HOU: A.Bachman (AFC South, ID: 00-0035602)"
HOU,RB,00-0036027,D.Anderson,AFC,AFC South,"RB, HOU: D.Anderson (AFC South, ID: 00-0036027)"
HOU,RB,00-0036069,S.Phillips,AFC,AFC South,"RB, HOU: S.Phillips (AFC South, ID: 00-0036069)"
HOU,RB,00-0036453,P.Quessenberry,AFC,AFC South,"RB, HOU: P.Quessenberry (AFC South, ID: 00-0036453)"
HOU,WR,00-0036554,N.Collins,AFC,AFC South,"WR, HOU: N.Collins (AFC South, ID: 00-0036554)"
HOU,TE,00-0036556,B.Jordan,AFC,AFC South,"TE, HOU: B.Jordan (AFC South, ID: 00-0036556)"
HOU,RB,00-0036578,G.Doaks,AFC,AFC South,"RB, HOU: G.Doaks (AFC South, ID: 00-0036578)"
HOU,TE,00-0036766,N.Eubanks,AFC,AFC South,"TE, HOU: N.Eubanks (AFC South, ID: 00-0036766)"
HOU,WR,00-0036858,J.Camp,AFC,AFC South,"WR, HOU: J.Camp (AFC South, ID: 00-0036858)"
HOU,QB,00-0036898,D.Mills,AFC,AFC South,"QB, HOU: D.Mills (AFC South, ID: 00-0036898)"
HOU,WR,00-0036991,A.Rodgers,AFC,AFC South,"WR, HOU: A.Rodgers (AFC South, ID: 00-0036991)"
HOU,RB,00-0037258,D.Pierce,AFC,AFC South,"RB, HOU: D.Pierce (AFC South, ID: 00-0037258)"
HOU,TE,00-0037277,T.Quitoriano,AFC,AFC South,"TE, HOU: T.Quitoriano (AFC South, ID: 00-0037277)"
HOU,WR,00-0037409,M.Young,AFC,AFC South,"WR, HOU: M.Young (AFC South, ID: 00-0037409)"
HOU,WR,00-0037454,D.Estrada,AFC,AFC South,"WR, HOU: D.Estrada (AFC South, ID: 00-0037454)"
HOU,RB,00-0037456,T.Hairston,AFC,AFC South,"RB, HOU: T.Hairston (AFC South, ID: 00-0037456)"
HOU,WR,00-0037460,J.Johnson,AFC,AFC South,"WR, HOU: J.Johnson (AFC South, ID: 00-0037460)"
HOU,WR,00-0037614,J.Metchie,AFC,AFC South,"WR, HOU: J.Metchie (AFC South, ID: 00-0037614)"
IND,QB,00-0026143,M.Ryan,AFC,AFC South,"QB, IND: M.Ryan (AFC South, ID: 00-0026143)"
IND,QB,00-0029567,N.Foles,AFC,AFC South,"QB, IND: N.Foles (AFC South, ID: 00-0029567)"
IND,TE,00-0033217,M.Alie-Cox,AFC,AFC South,"TE, IND: M.Alie-Cox (AFC South, ID: 00-0033217)"
IND,TE,00-0033258,D.Daniels,AFC,AFC South,"TE, IND: D.Daniels (AFC South, ID: 00-0033258)"
IND,RB,00-0034109,P.Lindsay,AFC,AFC South,"RB, IND: P.Lindsay (AFC South, ID: 00-0034109)"
IND,WR,00-0034366,K.Coutee,AFC,AFC South,"WR, IND: K.Coutee (AFC South, ID: 00-0034366)"
IND,RB,00-0034400,J.Wilkins,AFC,AFC South,"RB, IND: J.Wilkins (AFC South, ID: 00-0034400)"
IND,WR,00-0034510,R.Foster,AFC,AFC South,"WR, IND: R.Foster (AFC South, ID: 00-0034510)"
IND,WR,00-0034631,V.Smith,AFC,AFC South,"WR, IND: V.Smith (AFC South, ID: 00-0034631)"
IND,WR,00-0035021,A.Dulin,AFC,AFC South,"WR, IND: A.Dulin (AFC South, ID: 00-0035021)"
IND,K,00-0035358,C.McLaughlin,AFC,AFC South,"K, IND: C.McLaughlin (AFC South, ID: 00-0035358)"
IND,WR,00-0035639,P.Campbell,AFC,AFC South,"WR, IND: P.Campbell (AFC South, ID: 00-0035639)"
IND,WR,00-0035848,D.Harris,AFC,AFC South,"WR, IND: D.Harris (AFC South, ID: 00-0035848)"
IND,TE,00-0035981,N.Griffin-Stewart,AFC,AFC South,"TE, IND: N.Griffin-Stewart (AFC South, ID: 00-0035981)"
IND,RB,00-0036223,J.Taylor,AFC,AFC South,"RB, IND: J.Taylor (AFC South, ID: 00-0036223)"
IND,RB,00-0036251,Z.Moss,AFC,AFC South,"RB, IND: Z.Moss (AFC South, ID: 00-0036251)"
IND,WR,00-0036252,M.Pittman,AFC,AFC South,"WR, IND: M.Pittman (AFC South, ID: 00-0036252)"
IND,TE,00-0036456,D.Dafney,AFC,AFC South,"TE, IND: D.Dafney (AFC South, ID: 00-0036456)"
IND,WR,00-0036482,M.Strachan,AFC,AFC South,"WR, IND: M.Strachan (AFC South, ID: 00-0036482)"
IND,RB,00-0036493,D.Jackson,AFC,AFC South,"RB, IND: D.Jackson (AFC South, ID: 00-0036493)"
IND,RB,00-0036860,J.Funk,AFC,AFC South,"RB, IND: J.Funk (AFC South, ID: 00-0036860)"
IND,TE,00-0036876,K.Granson,AFC,AFC South,"TE, IND: K.Granson (AFC South, ID: 00-0036876)"
IND,QB,00-0036879,S.Ehlinger,AFC,AFC South,"QB, IND: S.Ehlinger (AFC South, ID: 00-0036879)"
IND,TE,00-0037022,M.Jacobson,AFC,AFC South,"TE, IND: M.Jacobson (AFC South, ID: 00-0037022)"
IND,TE,00-0037031,N.Kalinic,AFC,AFC South,"TE, IND: N.Kalinic (AFC South, ID: 00-0037031)"
IND,TE,00-0037292,A.Ogletree,AFC,AFC South,"TE, IND: A.Ogletree (AFC South, ID: 00-0037292)"
IND,QB,00-0037390,J.Coan,AFC,AFC South,"QB, IND: J.Coan (AFC South, ID: 00-0037390)"
IND,WR,00-0037391,K.Crawford,AFC,AFC South,"WR, IND: K.Crawford (AFC South, ID: 00-0037391)"
IND,WR,00-0037394,E.Fernea,AFC,AFC South,"WR, IND: E.Fernea (AFC South, ID: 00-0037394)"
IND,WR,00-0037398,S.Nacua,AFC,AFC South,"WR, IND: S.Nacua (AFC South, ID: 00-0037398)"
IND,RB,00-0037400,D.Price,AFC,AFC South,"RB, IND: D.Price (AFC South, ID: 00-0037400)"
IND,RB,00-0037405,C.Verdell,AFC,AFC South,"RB, IND: C.Verdell (AFC South, ID: 00-0037405)"
IND,TE,00-0037436,J.Wydermyer,AFC,AFC South,"TE, IND: J.Wydermyer (AFC South, ID: 00-0037436)"
IND,RB,00-0037609,A.Shampklin,AFC,AFC South,"RB, IND: A.Shampklin (AFC South, ID: 00-0037609)"
IND,TE,00-0037629,J.Scott,AFC,AFC South,"TE, IND: J.Scott (AFC South, ID: 00-0037629)"
IND,WR,00-0037664,A.Pierce,AFC,AFC South,"WR, IND: A.Pierce (AFC South, ID: 00-0037664)"
IND,TE,00-0037755,J.Woods,AFC,AFC South,"TE, IND: J.Woods (AFC South, ID: 00-0037755)"
JAX,WR,00-0029293,M.Jones,AFC,AFC South,"WR, JAX: M.Jones (AFC South, ID: 00-0029293)"
JAX,TE,00-0031484,C.Manhertz,AFC,AFC South,"TE, JAX: C.Manhertz (AFC South, ID: 00-0031484)"
JAX,WR,00-0033094,M.Hall,AFC,AFC South,"WR, JAX: M.Hall (AFC South, ID: 00-0033094)"
JAX,WR,00-0033572,J.Agnew,AFC,AFC South,"WR, JAX: J.Agnew (AFC South, ID: 00-0033572)"
JAX,TE,00-0033881,E.Engram,AFC,AFC South,"TE, JAX: E.Engram (AFC South, ID: 00-0033881)"
JAX,WR,00-0033891,I.Jones,AFC,AFC South,"WR, JAX: I.Jones (AFC South, ID: 00-0033891)"
JAX,QB,00-0033936,C.Beathard,AFC,AFC South,"QB, JAX: C.Beathard (AFC South, ID: 00-0033936)"
JAX,TE,00-0034011,D.Arnold,AFC,AFC South,"TE, JAX: D.Arnold (AFC South, ID: 00-0034011)"
JAX,WR,00-0034775,C.Kirk,AFC,AFC South,"WR, JAX: C.Kirk (AFC South, ID: 00-0034775)"
JAX,WR,00-0034837,C.Ridley,AFC,AFC South,"WR, JAX: C.Ridley (AFC South, ID: 00-0034837)"
JAX,RB,00-0035268,R.Armstead,AFC,AFC South,"RB, JAX: R.Armstead (AFC South, ID: 00-0035268)"
JAX,RB,00-0035664,D.Henderson,AFC,AFC South,"RB, JAX: D.Henderson (AFC South, ID: 00-0035664)"
JAX,RB,00-0035806,J.Hasty,AFC,AFC South,"RB, JAX: J.Hasty (AFC South, ID: 00-0035806)"
JAX,RB,00-0035835,N.Cottrell,AFC,AFC South,"RB, JAX: N.Cottrell (AFC South, ID: 00-0035835)"
JAX,WR,00-0036125,J.Moore,AFC,AFC South,"WR, JAX: J.Moore (AFC South, ID: 00-0036125)"
JAX,WR,00-0036497,T.Jones,AFC,AFC South,"WR, JAX: T.Jones (AFC South, ID: 00-0036497)"
JAX,WR,00-0036657,S.Williams,AFC,AFC South,"WR, JAX: S.Williams (AFC South, ID: 00-0036657)"
JAX,RB,00-0036698,M.Sargent,AFC,AFC South,"RB, JAX: M.Sargent (AFC South, ID: 00-0036698)"
JAX,K,00-0036816,R.Patterson,AFC,AFC South,"K, JAX: R.Patterson (AFC South, ID: 00-0036816)"
JAX,K,00-0036873,J.Verity,AFC,AFC South,"K, JAX: J.Verity (AFC South, ID: 00-0036873)"
JAX,TE,00-0036887,L.Farrell,AFC,AFC South,"TE, JAX: L.Farrell (AFC South, ID: 00-0036887)"
JAX,QB,00-0036971,T.Lawrence,AFC,AFC South,"QB, JAX: T.Lawrence (AFC South, ID: 00-0036971)"
JAX,RB,00-0036973,T.Etienne,AFC,AFC South,"RB, JAX: T.Etienne (AFC South, ID: 00-0036973)"
JAX,TE,00-0037063,G.Gunter,AFC,AFC South,"TE, JAX: G.Gunter (AFC South, ID: 00-0037063)"
JAX,K,00-0037065,A.Mevis,AFC,AFC South,"K, JAX: A.Mevis (AFC South, ID: 00-0037065)"
JAX,QB,00-0037068,E.Perry,AFC,AFC South,"QB, JAX: E.Perry (AFC South, ID: 00-0037068)"
JAX,WR,00-0037071,L.Winningham,AFC,AFC South,"WR, JAX: L.Winningham (AFC South, ID: 00-0037071)"
JAX,WR,00-0037231,K.Austin,AFC,AFC South,"WR, JAX: K.Austin (AFC South, ID: 00-0037231)"
JAX,TE,00-0037233,G.Prince,AFC,AFC South,"TE, JAX: G.Prince (AFC South, ID: 00-0037233)"
JAX,RB,00-0037265,J.Conner,AFC,AFC South,"RB, JAX: J.Conner (AFC South, ID: 00-0037265)"
JAX,WR,00-0037422,K.Pryor,AFC,AFC South,"WR, JAX: K.Pryor (AFC South, ID: 00-0037422)"
JAX,K,00-0037471,J.McCourt,AFC,AFC South,"K, JAX: J.McCourt (AFC South, ID: 00-0037471)"
JAX,WR,00-0037641,W.Johnson,AFC,AFC South,"WR, JAX: W.Johnson (AFC South, ID: 00-0037641)"
JAX,TE,00-0037642,N.Bohannon,AFC,AFC South,"TE, JAX: N.Bohannon (AFC South, ID: 00-0037642)"
JAX,WR,00-0037648,R.McDaniel,AFC,AFC South,"WR, JAX: R.McDaniel (AFC South, ID: 00-0037648)"
JAX,QB,,N.Rourke,AFC,AFC South,"QB, JAX: N.Rourke (AFC South, ID: NA)"
KC,QB,00-0026197,C.Henne,AFC,AFC West,"QB, KC: C.Henne (AFC West, ID: 00-0026197)"
KC,TE,00-0030506,T.Kelce,AFC,AFC West,"TE, KC: T.Kelce (AFC West, ID: 00-0030506)"
KC,RB,00-0031376,J.McKinnon,AFC,AFC West,"RB, KC: J.McKinnon (AFC West, ID: 00-0031376)"
KC,RB,00-0031595,M.Burton,AFC,AFC West,"RB, KC: M.Burton (AFC West, ID: 00-0031595)"
KC,TE,00-0032062,B.Bell,AFC,AFC West,"TE, KC: B.Bell (AFC West, ID: 00-0032062)"
KC,RB,00-0032144,M.Gordon,AFC,AFC West,"RB, KC: M.Gordon (AFC West, ID: 00-0032144)"
KC,WR,00-0032966,C.Coleman,AFC,AFC West,"WR, KC: C.Coleman (AFC West, ID: 00-0032966)"
KC,K,00-0033303,H.Butker,AFC,AFC West,"K, KC: H.Butker (AFC West, ID: 00-0033303)"
KC,WR,00-0033460,J.Ross,AFC,AFC West,"WR, KC: J.Ross (AFC West, ID: 00-0033460)"
KC,WR,00-0033481,M.Kemp,AFC,AFC West,"WR, KC: M.Kemp (AFC West, ID: 00-0033481)"
KC,WR,00-0033857,J.Smith-Schuster,AFC,AFC West,"WR, KC: J.Smith-Schuster (AFC West, ID: 00-0033857)"
KC,QB,00-0033873,P.Mahomes,AFC,AFC West,"QB, KC: P.Mahomes (AFC West, ID: 00-0033873)"
KC,WR,00-0034272,M.Valdes-Scantling,AFC,AFC West,"WR, KC: M.Valdes-Scantling (AFC West, ID: 00-0034272)"
KC,WR,00-0034386,J.Watson,AFC,AFC West,"WR, KC: J.Watson (AFC West, ID: 00-0034386)"
KC,TE,00-0034532,J.Franks,AFC,AFC West,"TE, KC: J.Franks (AFC West, ID: 00-0034532)"
KC,RB,00-0034816,R.Jones,AFC,AFC West,"RB, KC: R.Jones (AFC West, ID: 00-0034816)"
KC,WR,00-0035140,M.Hardman,AFC,AFC West,"WR, KC: M.Hardman (AFC West, ID: 00-0035140)"
KC,K,00-0035189,M.Wright,AFC,AFC West,"K, KC: M.Wright (AFC West, ID: 00-0035189)"
KC,TE,00-0035547,J.Fortson,AFC,AFC West,"TE, KC: J.Fortson (AFC West, ID: 00-0035547)"
KC,WR,00-0035589,G.Jennings,AFC,AFC West,"WR, KC: G.Jennings (AFC West, ID: 00-0035589)"
KC,TE,00-0035603,K.Blanton,AFC,AFC West,"TE, KC: K.Blanton (AFC West, ID: 00-0035603)"
KC,WR,00-0035947,O.Bayless,AFC,AFC West,"WR, KC: O.Bayless (AFC West, ID: 00-0035947)"
KC,WR,00-0036034,A.Parker,AFC,AFC West,"WR, KC: A.Parker (AFC West, ID: 00-0036034)"
KC,RB,00-0036269,L.Perine,AFC,AFC West,"RB, KC: L.Perine (AFC West, ID: 00-0036269)"
KC,RB,00-0036360,C.Edwards-Helaire,AFC,AFC West,"RB, KC: C.Edwards-Helaire (AFC West, ID: 00-0036360)"
KC,WR,00-0036365,B.Edwards,AFC,AFC West,"WR, KC: B.Edwards (AFC West, ID: 00-0036365)"
KC,WR,00-0036471,M.Sexton,AFC,AFC West,"WR, KC: M.Sexton (AFC West, ID: 00-0036471)"
KC,TE,00-0036519,M.Bushman,AFC,AFC West,"TE, KC: M.Bushman (AFC West, ID: 00-0036519)"
KC,WR,00-0036635,I.Smith-Marsette,AFC,AFC West,"WR, KC: I.Smith-Marsette (AFC West, ID: 00-0036635)"
KC,TE,00-0036637,N.Gray,AFC,AFC West,"TE, KC: N.Gray (AFC West, ID: 00-0036637)"
KC,WR,00-0036647,C.Powell,AFC,AFC West,"WR, KC: C.Powell (AFC West, ID: 00-0036647)"
KC,QB,00-0036679,S.Buechele,AFC,AFC West,"QB, KC: S.Buechele (AFC West, ID: 00-0036679)"
KC,WR,00-0036913,K.Toney,AFC,AFC West,"WR, KC: K.Toney (AFC West, ID: 00-0036913)"
KC,TE,00-0037036,M.Vital,AFC,AFC West,"TE, KC: M.Vital (AFC West, ID: 00-0037036)"
KC,RB,00-0037197,I.Pacheco,AFC,AFC West,"RB, KC: I.Pacheco (AFC West, ID: 00-0037197)"
KC,QB,00-0037209,D.Crum,AFC,AFC West,"QB, KC: D.Crum (AFC West, ID: 00-0037209)"
KC,RB,00-0037210,J.Ealy,AFC,AFC West,"RB, KC: J.Ealy (AFC West, ID: 00-0037210)"
KC,RB,00-0037211,T.Fleet-Davis,AFC,AFC West,"RB, KC: T.Fleet-Davis (AFC West, ID: 00-0037211)"
KC,TE,00-0037213,K.Oginni,AFC,AFC West,"TE, KC: K.Oginni (AFC West, ID: 00-0037213)"
KC,WR,00-0037216,J.Ross,AFC,AFC West,"WR, KC: J.Ross (AFC West, ID: 00-0037216)"
KC,QB,00-0037324,C.Oladokun,AFC,AFC West,"QB, KC: C.Oladokun (AFC West, ID: 00-0037324)"
KC,WR,00-0037566,T.Fryfogle,AFC,AFC West,"WR, KC: T.Fryfogle (AFC West, ID: 00-0037566)"
KC,WR,00-0038090,S.Moore,AFC,AFC West,"WR, KC: S.Moore (AFC West, ID: 00-0038090)"
LA,QB,00-0026498,J.Stafford,NFC,NFC West,"QB, LA: J.Stafford (NFC West, ID: 00-0026498)"
LA,WR,00-0031428,A.Robinson,NFC,NFC West,"WR, LA: A.Robinson (NFC West, ID: 00-0031428)"
LA,RB,00-0031806,M.Brown,NFC,NFC West,"RB, LA: M.Brown (NFC West, ID: 00-0031806)"
LA,TE,00-0033110,T.Higbee,NFC,NFC West,"TE, LA: T.Higbee (NFC West, ID: 00-0033110)"
LA,WR,00-0033908,C.Kupp,NFC,NFC West,"WR, LA: C.Kupp (NFC West, ID: 00-0033908)"
LA,WR,00-0033992,L.Lenoir,NFC,NFC West,"WR, LA: L.Lenoir (NFC West, ID: 00-0033992)"
LA,WR,00-0034646,B.Powell,NFC,NFC West,"WR, LA: B.Powell (NFC West, ID: 00-0034646)"
LA,QB,00-0034855,B.Mayfield,NFC,NFC West,"QB, LA: B.Mayfield (NFC West, ID: 00-0034855)"
LA,QB,00-0034899,J.Wolford,NFC,NFC West,"QB, LA: J.Wolford (NFC West, ID: 00-0034899)"
LA,K,00-0035269,M.Gay,NFC,NFC West,"K, LA: M.Gay (NFC West, ID: 00-0035269)"
LA,TE,00-0035787,J.Pinkney,NFC,NFC West,"TE, LA: J.Pinkney (NFC West, ID: 00-0035787)"
LA,QB,00-0035812,S.Cookus,NFC,NFC West,"QB, LA: S.Cookus (NFC West, ID: 00-0035812)"
LA,TE,00-0035817,K.Markway,NFC,NFC West,"TE, LA: K.Markway (NFC West, ID: 00-0035817)"
LA,WR,00-0035935,J.Koski,NFC,NFC West,"WR, LA: J.Koski (NFC West, ID: 00-0035935)"
LA,QB,00-0035939,B.Perkins,NFC,NFC West,"QB, LA: B.Perkins (NFC West, ID: 00-0035939)"
LA,RB,00-0036078,X.Jones,NFC,NFC West,"RB, LA: X.Jones (NFC West, ID: 00-0036078)"
LA,RB,00-0036414,C.Akers,NFC,NFC West,"RB, LA: C.Akers (NFC West, ID: 00-0036414)"
LA,WR,00-0036415,V.Jefferson,NFC,NFC West,"WR, LA: V.Jefferson (NFC West, ID: 00-0036415)"
LA,TE,00-0036424,B.Hopkins,NFC,NFC West,"TE, LA: B.Hopkins (NFC West, ID: 00-0036424)"
LA,RB,00-0036435,R.Calais,NFC,NFC West,"RB, LA: R.Calais (NFC West, ID: 00-0036435)"
LA,RB,00-0036523,T.Ragas,NFC,NFC West,"RB, LA: T.Ragas (NFC West, ID: 00-0036523)"
LA,WR,00-0036598,L.Akers,NFC,NFC West,"WR, LA: L.Akers (NFC West, ID: 00-0036598)"
LA,WR,00-0036721,W.Jackson,NFC,NFC West,"WR, LA: W.Jackson (NFC West, ID: 00-0036721)"
LA,WR,00-0036841,A.Trammell,NFC,NFC West,"WR, LA: A.Trammell (NFC West, ID: 00-0036841)"
LA,WR,00-0036849,C.Atwell,NFC,NFC West,"WR, LA: C.Atwell (NFC West, ID: 00-0036849)"
LA,WR,00-0036862,B.Skowronek,NFC,NFC West,"WR, LA: B.Skowronek (NFC West, ID: 00-0036862)"
LA,WR,00-0036918,J.Harris,NFC,NFC West,"WR, LA: J.Harris (NFC West, ID: 00-0036918)"
LA,WR,00-0037055,L.McCutcheon,NFC,NFC West,"WR, LA: L.McCutcheon (NFC West, ID: 00-0037055)"
LA,TE,00-0037059,J.Pettigrew,NFC,NFC West,"TE, LA: J.Pettigrew (NFC West, ID: 00-0037059)"
LA,WR,00-0037486,J.Sterns,NFC,NFC West,"WR, LA: J.Sterns (NFC West, ID: 00-0037486)"
LA,RB,00-0037557,R.Rivers,NFC,NFC West,"RB, LA: R.Rivers (NFC West, ID: 00-0037557)"
LA,WR,00-0037574,J.Roberson,NFC,NFC West,"WR, LA: J.Roberson (NFC West, ID: 00-0037574)"
LA,TE,00-0037632,R.Carter,NFC,NFC West,"TE, LA: R.Carter (NFC West, ID: 00-0037632)"
LA,RB,00-0037840,K.Williams,NFC,NFC West,"RB, LA: K.Williams (NFC West, ID: 00-0037840)"
LAC,QB,00-0026544,W.Daniel,AFC,AFC West,"QB, LAC: W.Daniel (AFC West, ID: 00-0026544)"
LAC,K,00-0030098,D.Hopkins,AFC,AFC West,"K, LAC: D.Hopkins (AFC West, ID: 00-0030098)"
LAC,WR,00-0030279,K.Allen,AFC,AFC West,"WR, LAC: K.Allen (AFC West, ID: 00-0030279)"
LAC,TE,00-0031384,R.Rodgers,AFC,AFC West,"TE, LAC: R.Rodgers (AFC West, ID: 00-0031384)"
LAC,WR,00-0031763,D.Carter,AFC,AFC West,"WR, LAC: D.Carter (AFC West, ID: 00-0031763)"
LAC,K,00-0032669,T.Bertolet,AFC,AFC West,"K, LAC: T.Bertolet (AFC West, ID: 00-0032669)"
LAC,WR,00-0033536,M.Williams,AFC,AFC West,"WR, LAC: M.Williams (AFC West, ID: 00-0033536)"
LAC,RB,00-0033699,A.Ekeler,AFC,AFC West,"RB, LAC: A.Ekeler (AFC West, ID: 00-0033699)"
