team_abbr,position,player_id,player_name,team_conf,team_division,lookup_string
LAC,TE,00-0033895,G.Everett,AFC,AFC West,"TE, LAC: G.Everett (AFC West, ID: 00-0033895)"
LAC,RB,00-0034845,S.Michel,AFC,AFC West,"RB, LAC: S.Michel (AFC West, ID: 00-0034845)"
LAC,WR,00-0035120,K.Doss,AFC,AFC West,"WR, LAC: K.Doss (AFC West, ID: 00-0035120)"
LAC,QB,00-0035282,E.Stick,AFC,AFC West,"QB, LAC: E.Stick (AFC West, ID: 00-0035282)"
LAC,TE,00-0035329,D.Parham,AFC,AFC West,"TE, LAC: D.Parham (AFC West, ID: 00-0035329)"
LAC,WR,00-0035414,J.Guyton,AFC,AFC West,"WR, LAC: J.Guyton (AFC West, ID: 00-0035414)"
LAC,WR,00-0035432,J.Moore,AFC,AFC West,"WR, LAC: J.Moore (AFC West, ID: 00-0035432)"
LAC,WR,00-0035883,M.Ffrench,AFC,AFC West,"WR, LAC: M.Ffrench (AFC West, ID: 00-0035883)"
LAC,RB,00-0035908,G.Nabers,AFC,AFC West,"RB, LAC: G.Nabers (AFC West, ID: 00-0035908)"
LAC,QB,00-0036355,J.Herbert,AFC,AFC West,"QB, LAC: J.Herbert (AFC West, ID: 00-0036355)"
LAC,RB,00-0036370,J.Kelley,AFC,AFC West,"RB, LAC: J.Kelley (AFC West, ID: 00-0036370)"
LAC,WR,00-0036377,J.Reed,AFC,AFC West,"WR, LAC: J.Reed (AFC West, ID: 00-0036377)"
LAC,WR,00-0036398,J.Hightower,AFC,AFC West,"WR, LAC: J.Hightower (AFC West, ID: 00-0036398)"
LAC,RB,00-0036650,L.Rountree,AFC,AFC West,"RB, LAC: L.Rountree (AFC West, ID: 00-0036650)"
LAC,WR,00-0036753,S.Surratt,AFC,AFC West,"WR, LAC: S.Surratt (AFC West, ID: 00-0036753)"
LAC,TE,00-0036779,H.Kampmoyer,AFC,AFC West,"TE, LAC: H.Kampmoyer (AFC West, ID: 00-0036779)"
LAC,WR,00-0036959,M.Bandy,AFC,AFC West,"WR, LAC: M.Bandy (AFC West, ID: 00-0036959)"
LAC,WR,00-0036988,J.Palmer,AFC,AFC West,"WR, LAC: J.Palmer (AFC West, ID: 00-0036988)"
LAC,TE,00-0037011,T.McKitty,AFC,AFC West,"TE, LAC: T.McKitty (AFC West, ID: 00-0037011)"
LAC,RB,00-0037331,A.Horvath,AFC,AFC West,"RB, LAC: A.Horvath (AFC West, ID: 00-0037331)"
LAC,WR,00-0037465,T.Bradford,AFC,AFC West,"WR, LAC: T.Bradford (AFC West, ID: 00-0037465)"
LAC,RB,00-0037466,L.Brown,AFC,AFC West,"RB, LAC: L.Brown (AFC West, ID: 00-0037466)"
LAC,TE,00-0037467,E.Krommenhoek,AFC,AFC West,"TE, LAC: E.Krommenhoek (AFC West, ID: 00-0037467)"
LAC,RB,00-0037470,K.Marks,AFC,AFC West,"RB, LAC: K.Marks (AFC West, ID: 00-0037470)"
LAC,QB,00-0037472,B.Peters,AFC,AFC West,"QB, LAC: B.Peters (AFC West, ID: 00-0037472)"
LAC,TE,00-0037475,S.Smartt,AFC,AFC West,"TE, LAC: S.Smartt (AFC West, ID: 00-0037475)"
LAC,RB,00-0038045,I.Spiller,AFC,AFC West,"RB, LAC: I.Spiller (AFC West, ID: 00-0038045)"
LV,RB,00-0029239,B.Bolden,AFC,AFC West,"RB, LV: B.Bolden (AFC West, ID: 00-0029239)"
LV,WR,00-0030669,A.Wilson,AFC,AFC West,"WR, LV: A.Wilson (AFC West, ID: 00-0030669)"
LV,QB,00-0031280,D.Carr,AFC,AFC West,"QB, LV: D.Carr (AFC West, ID: 00-0031280)"
LV,WR,00-0031381,D.Adams,AFC,AFC West,"WR, LV: D.Adams (AFC West, ID: 00-0031381)"
LV,TE,00-0031610,D.Waller,AFC,AFC West,"TE, LV: D.Waller (AFC West, ID: 00-0031610)"
LV,RB,00-0032104,A.Abdullah,AFC,AFC West,"RB, LV: A.Abdullah (AFC West, ID: 00-0032104)"
LV,WR,00-0033555,M.Hollins,AFC,AFC West,"WR, LV: M.Hollins (AFC West, ID: 00-0033555)"
LV,WR,00-0033681,K.Cole,AFC,AFC West,"WR, LV: K.Cole (AFC West, ID: 00-0033681)"
LV,K,00-0034161,D.Carlson,AFC,AFC West,"K, LV: D.Carlson (AFC West, ID: 00-0034161)"
LV,WR,00-0034593,C.Lacy,AFC,AFC West,"WR, LV: C.Lacy (AFC West, ID: 00-0034593)"
LV,WR,00-0034669,J.Veasy,AFC,AFC West,"WR, LV: J.Veasy (AFC West, ID: 00-0034669)"
LV,TE,00-0034981,F.Moreau,AFC,AFC West,"TE, LV: F.Moreau (AFC West, ID: 00-0034981)"
LV,WR,00-0034983,H.Renfrow,AFC,AFC West,"WR, LV: H.Renfrow (AFC West, ID: 00-0034983)"
LV,RB,00-0035187,A.Walter,AFC,AFC West,"RB, LV: A.Walter (AFC West, ID: 00-0035187)"
LV,QB,00-0035264,J.Stidham,AFC,AFC West,"QB, LV: J.Stidham (AFC West, ID: 00-0035264)"
LV,TE,00-0035562,J.Horsted,AFC,AFC West,"TE, LV: J.Horsted (AFC West, ID: 00-0035562)"
LV,RB,00-0035700,J.Jacobs,AFC,AFC West,"RB, LV: J.Jacobs (AFC West, ID: 00-0035700)"
LV,RB,00-0035726,J.Johnson,AFC,AFC West,"RB, LV: J.Johnson (AFC West, ID: 00-0035726)"
LV,WR,00-0036100,I.Zuber,AFC,AFC West,"WR, LV: I.Zuber (AFC West, ID: 00-0036100)"
LV,WR,00-0036526,D.Stoner,AFC,AFC West,"WR, LV: D.Stoner (AFC West, ID: 00-0036526)"
LV,WR,00-0036527,D.Turner,AFC,AFC West,"WR, LV: D.Turner (AFC West, ID: 00-0036527)"
LV,RB,00-0037329,B.Brown,AFC,AFC West,"RB, LV: B.Brown (AFC West, ID: 00-0037329)"
LV,TE,00-0037506,C.Fotheringham,AFC,AFC West,"TE, LV: C.Fotheringham (AFC West, ID: 00-0037506)"
LV,QB,00-0037507,C.Garbers,AFC,AFC West,"QB, LV: C.Garbers (AFC West, ID: 00-0037507)"
LV,WR,00-0037508,J.Hall,AFC,AFC West,"WR, LV: J.Hall (AFC West, ID: 00-0037508)"
LV,RB,00-0037509,S.McCormick,AFC,AFC West,"RB, LV: S.McCormick (AFC West, ID: 00-0037509)"
LV,RB,00-0038040,Z.White,AFC,AFC West,"RB, LV: Z.White (AFC West, ID: 00-0038040)"
MIA,WR,00-0029632,M.Sanu,AFC,AFC East,"WR, MIA: M.Sanu (AFC East, ID: 00-0029632)"
MIA,QB,00-0030520,M.Glennon,AFC,AFC East,"QB, MIA: M.Glennon (AFC East, ID: 00-0030520)"
MIA,QB,00-0031237,T.Bridgewater,AFC,AFC East,"QB, MIA: T.Bridgewater (AFC East, ID: 00-0031237)"
MIA,RB,00-0031687,D.Mostert,AFC,AFC East,"RB, MIA: D.Mostert (AFC East, ID: 00-0031687)"
MIA,WR,00-0032795,C.Core,AFC,AFC East,"WR, MIA: C.Core (AFC East, ID: 00-0032795)"
MIA,WR,00-0033040,T.Hill,AFC,AFC East,"WR, MIA: T.Hill (AFC East, ID: 00-0033040)"
MIA,TE,00-0033338,C.Carter,AFC,AFC East,"TE, MIA: C.Carter (AFC East, ID: 00-0033338)"
MIA,TE,00-0033896,A.Shaheen,AFC,AFC East,"TE, MIA: A.Shaheen (AFC East, ID: 00-0033896)"
MIA,WR,00-0034054,T.Cracraft,AFC,AFC East,"WR, MIA: T.Cracraft (AFC East, ID: 00-0034054)"
MIA,RB,00-0034115,J.Wilson,AFC,AFC East,"RB, MIA: J.Wilson (AFC East, ID: 00-0034115)"
MIA,WR,00-0034370,D.Hamilton,AFC,AFC East,"WR, MIA: D.Hamilton (AFC East, ID: 00-0034370)"
MIA,WR,00-0034418,C.Wilson,AFC,AFC East,"WR, MIA: C.Wilson (AFC East, ID: 00-0034418)"
MIA,WR,00-0034487,T.Sherfield,AFC,AFC East,"WR, MIA: T.Sherfield (AFC East, ID: 00-0034487)"
MIA,K,00-0034794,J.Sanders,AFC,AFC East,"K, MIA: J.Sanders (AFC East, ID: 00-0034794)"
MIA,TE,00-0034798,D.Smythe,AFC,AFC East,"TE, MIA: D.Smythe (AFC East, ID: 00-0034798)"
MIA,TE,00-0034829,M.Gesicki,AFC,AFC East,"TE, MIA: M.Gesicki (AFC East, ID: 00-0034829)"
MIA,RB,00-0035125,A.Ingold,AFC,AFC East,"RB, MIA: A.Ingold (AFC East, ID: 00-0035125)"
MIA,QB,00-0035161,J.Lovett,AFC,AFC East,"QB, MIA: J.Lovett (AFC East, ID: 00-0035161)"
MIA,RB,00-0035311,M.Gaskin,AFC,AFC East,"RB, MIA: M.Gaskin (AFC East, ID: 00-0035311)"
MIA,RB,00-0035975,J.Bargas,AFC,AFC East,"RB, MIA: J.Bargas (AFC East, ID: 00-0035975)"
MIA,RB,00-0036020,S.Ahmed,AFC,AFC East,"RB, MIA: S.Ahmed (AFC East, ID: 00-0036020)"
MIA,QB,00-0036052,R.Sinnett,AFC,AFC East,"QB, MIA: R.Sinnett (AFC East, ID: 00-0036052)"
MIA,QB,00-0036212,T.Tagovailoa,AFC,AFC East,"QB, MIA: T.Tagovailoa (AFC East, ID: 00-0036212)"
MIA,WR,00-0036613,J.Waddle,AFC,AFC East,"WR, MIA: J.Waddle (AFC East, ID: 00-0036613)"
MIA,TE,00-0037004,H.Long,AFC,AFC East,"TE, MIA: H.Long (AFC East, ID: 00-0037004)"
MIA,WR,00-0037029,D.Dedmon,AFC,AFC East,"WR, MIA: D.Dedmon (AFC East, ID: 00-0037029)"
MIA,WR,00-0037221,C.Jackson,AFC,AFC East,"WR, MIA: C.Jackson (AFC East, ID: 00-0037221)"
MIA,QB,00-0037327,S.Thompson,AFC,AFC East,"QB, MIA: S.Thompson (AFC East, ID: 00-0037327)"
MIA,WR,00-0037348,T.Conner,AFC,AFC East,"WR, MIA: T.Conner (AFC East, ID: 00-0037348)"
MIA,WR,00-0037355,B.Sanders,AFC,AFC East,"WR, MIA: B.Sanders (AFC East, ID: 00-0037355)"
MIA,RB,00-0037357,Z.White,AFC,AFC East,"RB, MIA: Z.White (AFC East, ID: 00-0037357)"
MIA,WR,00-0038092,E.Ezukanma,AFC,AFC East,"WR, MIA: E.Ezukanma (AFC East, ID: 00-0038092)"
MIN,QB,00-0029604,K.Cousins,NFC,NFC North,"QB, MIN: K.Cousins (NFC North, ID: 00-0029604)"
MIN,WR,00-0030035,A.Thielen,NFC,NFC North,"WR, MIN: A.Thielen (NFC North, ID: 00-0030035)"
MIN,TE,00-0031951,J.O'Shaughnessy,NFC,NFC North,"TE, MIN: J.O'Shaughnessy (NFC North, ID: 00-0031951)"
MIN,RB,00-0032918,C.Ham,NFC,NFC North,"RB, MIN: C.Ham (NFC North, ID: 00-0032918)"
MIN,TE,00-0033246,J.Mundt,NFC,NFC North,"TE, MIN: J.Mundt (NFC North, ID: 00-0033246)"
MIN,QB,00-0033319,N.Mullens,NFC,NFC North,"QB, MIN: N.Mullens (NFC North, ID: 00-0033319)"
MIN,RB,00-0033893,D.Cook,NFC,NFC North,"RB, MIN: D.Cook (NFC North, ID: 00-0033893)"
MIN,QB,00-0034343,J.Rosen,NFC,NFC North,"QB, MIN: J.Rosen (NFC North, ID: 00-0034343)"
MIN,K,00-0034450,G.Joseph,NFC,NFC North,"K, MIN: G.Joseph (NFC North, ID: 00-0034450)"
MIN,TE,00-0034970,I.Smith,NFC,NFC North,"TE, MIN: I.Smith (NFC North, ID: 00-0034970)"
MIN,RB,00-0034972,A.Mattison,NFC,NFC North,"RB, MIN: A.Mattison (NFC North, ID: 00-0034972)"
MIN,WR,00-0035006,O.Johnson,NFC,NFC North,"WR, MIN: O.Johnson (NFC North, ID: 00-0035006)"
MIN,TE,00-0035229,T.Hockenson,NFC,NFC North,"TE, MIN: T.Hockenson (NFC North, ID: 00-0035229)"
MIN,TE,00-0035823,B.Ellefson,NFC,NFC North,"TE, MIN: B.Ellefson (NFC North, ID: 00-0035823)"
MIN,WR,00-0035934,T.Jackson,NFC,NFC North,"WR, MIN: T.Jackson (NFC North, ID: 00-0035934)"
MIN,WR,00-0035976,D.Chisena,NFC,NFC North,"WR, MIN: D.Chisena (NFC North, ID: 00-0035976)"
MIN,QB,00-0036279,N.Stanley,NFC,NFC North,"QB, MIN: N.Stanley (NFC North, ID: 00-0036279)"
MIN,WR,00-0036322,J.Jefferson,NFC,NFC North,"WR, MIN: J.Jefferson (NFC North, ID: 00-0036322)"
MIN,WR,00-0036345,K.Osborn,NFC,NFC North,"WR, MIN: K.Osborn (NFC North, ID: 00-0036345)"
MIN,WR,00-0036387,J.Reagor,NFC,NFC North,"WR, MIN: J.Reagor (NFC North, ID: 00-0036387)"
MIN,WR,00-0036815,M.Mitchell,NFC,NFC North,"WR, MIN: M.Mitchell (NFC North, ID: 00-0036815)"
MIN,WR,00-0036818,C.Proehl,NFC,NFC North,"WR, MIN: C.Proehl (NFC North, ID: 00-0036818)"
MIN,RB,00-0036842,K.Nwangwu,NFC,NFC North,"RB, MIN: K.Nwangwu (NFC North, ID: 00-0036842)"
MIN,WR,00-0036931,T.Toivonen,NFC,NFC North,"WR, MIN: T.Toivonen (NFC North, ID: 00-0036931)"
MIN,RB,00-0037276,T.Chandler,NFC,NFC North,"RB, MIN: T.Chandler (NFC North, ID: 00-0037276)"
MIN,WR,00-0037291,J.Nailor,NFC,NFC North,"WR, MIN: J.Nailor (NFC North, ID: 00-0037291)"
MIN,TE,00-0037317,N.Muse,NFC,NFC North,"TE, MIN: N.Muse (NFC North, ID: 00-0037317)"
MIN,WR,00-0037494,T.Hennigan,NFC,NFC North,"WR, MIN: T.Hennigan (NFC North, ID: 00-0037494)"
MIN,RB,00-0037495,B.Koback,NFC,NFC North,"RB, MIN: B.Koback (NFC North, ID: 00-0037495)"
NE,K,00-0025565,N.Folk,AFC,AFC East,"K, NE: N.Folk (AFC East, ID: 00-0025565)"
NE,WR,00-0026293,M.Slater,AFC,AFC East,"WR, NE: M.Slater (AFC East, ID: 00-0026293)"
NE,QB,00-0026625,B.Hoyer,AFC,AFC East,"QB, NE: B.Hoyer (AFC East, ID: 00-0026625)"
NE,RB,00-0031062,J.White,AFC,AFC East,"RB, NE: J.White (AFC East, ID: 00-0031062)"
NE,QB,00-0031395,G.Gilbert,AFC,AFC East,"QB, NE: G.Gilbert (AFC East, ID: 00-0031395)"
NE,WR,00-0031547,D.Parker,AFC,AFC East,"WR, NE: D.Parker (AFC East, ID: 00-0031547)"
NE,WR,00-0031549,N.Agholor,AFC,AFC East,"WR, NE: N.Agholor (AFC East, ID: 00-0031549)"
NE,WR,00-0032200,T.Montgomery,AFC,AFC East,"WR, NE: T.Montgomery (AFC East, ID: 00-0032200)"
NE,TE,00-0033090,H.Henry,AFC,AFC East,"TE, NE: H.Henry (AFC East, ID: 00-0033090)"
NE,WR,00-0033307,K.Bourne,AFC,AFC East,"WR, NE: K.Bourne (AFC East, ID: 00-0033307)"
NE,TE,00-0033858,J.Smith,AFC,AFC East,"TE, NE: J.Smith (AFC East, ID: 00-0033858)"
NE,WR,00-0034960,J.Meyers,AFC,AFC East,"WR, NE: J.Meyers (AFC East, ID: 00-0034960)"
NE,WR,00-0035406,L.Humphrey,AFC,AFC East,"WR, NE: L.Humphrey (AFC East, ID: 00-0035406)"
NE,TE,00-0035436,M.Sokol,AFC,AFC East,"TE, NE: M.Sokol (AFC East, ID: 00-0035436)"
NE,RB,00-0035657,D.Harris,AFC,AFC East,"RB, NE: D.Harris (AFC East, ID: 00-0035657)"
NE,TE,00-0035769,S.Washington,AFC,AFC East,"TE, NE: S.Washington (AFC East, ID: 00-0035769)"
NE,WR,00-0035826,J.Hammond,AFC,AFC East,"WR, NE: J.Hammond (AFC East, ID: 00-0035826)"
NE,RB,00-0036096,J.Taylor,AFC,AFC East,"RB, NE: J.Taylor (AFC East, ID: 00-0036096)"
NE,WR,00-0036183,K.Wilkerson,AFC,AFC East,"WR, NE: K.Wilkerson (AFC East, ID: 00-0036183)"
NE,RB,00-0036245,M.Perry,AFC,AFC East,"RB, NE: M.Perry (AFC East, ID: 00-0036245)"
NE,RB,00-0036364,L.Bowden,AFC,AFC East,"RB, NE: L.Bowden (AFC East, ID: 00-0036364)"
NE,K,00-0036488,Q.Nordin,AFC,AFC East,"K, NE: Q.Nordin (AFC East, ID: 00-0036488)"
NE,WR,00-0036536,T.Nixon,AFC,AFC East,"WR, NE: T.Nixon (AFC East, ID: 00-0036536)"
NE,RB,00-0036875,R.Stevenson,AFC,AFC East,"RB, NE: R.Stevenson (AFC East, ID: 00-0036875)"
NE,QB,00-0036972,M.Jones,AFC,AFC East,"QB, NE: M.Jones (AFC East, ID: 00-0036972)"
NE,WR,00-0037185,R.Webb,AFC,AFC East,"WR, NE: R.Webb (AFC East, ID: 00-0037185)"
NE,RB,00-0037286,K.Harris,AFC,AFC East,"RB, NE: K.Harris (AFC East, ID: 00-0037286)"
NE,RB,00-0038098,P.Strong,AFC,AFC East,"RB, NE: P.Strong (AFC East, ID: 00-0038098)"
NE,WR,00-0038104,T.Thornton,AFC,AFC East,"WR, NE: T.Thornton (AFC East, ID: 00-0038104)"
NE,QB,00-0038108,B.Zappe,AFC,AFC East,"QB, NE: B.Zappe (AFC East, ID: 00-0038108)"
NO,RB,00-0027966,M.Ingram,NFC,NFC South,"RB, NO: M.Ingram (NFC South, ID: 00-0027966)"
NO,QB,00-0027973,A.Dalton,NFC,NFC South,"QB, NO: A.Dalton (NFC South, ID: 00-0027973)"
NO,WR,00-0031382,J.Landry,NFC,NFC South,"WR, NO: J.Landry (NFC South, ID: 00-0031382)"
NO,QB,00-0031503,J.Winston,NFC,NFC South,"QB, NO: J.Winston (NFC South, ID: 00-0031503)"
NO,WR,00-0031545,K.White,NFC,NFC South,"WR, NO: K.White (NFC South, ID: 00-0031545)"
NO,RB,00-0032187,D.Johnson,NFC,NFC South,"RB, NO: D.Johnson (NFC South, ID: 00-0032187)"
NO,RB,00-0032450,D.Washington,NFC,NFC South,"RB, NO: D.Washington (NFC South, ID: 00-0032450)"
NO,K,00-0032569,W.Lutz,NFC,NFC South,"K, NO: W.Lutz (NFC South, ID: 00-0032569)"
NO,WR,00-0032765,M.Thomas,NFC,NFC South,"WR, NO: M.Thomas (NFC South, ID: 00-0032765)"
NO,RB,00-0032780,J.Howard,NFC,NFC South,"RB, NO: J.Howard (NFC South, ID: 00-0032780)"
NO,TE,00-0032986,J.Holtz,NFC,NFC South,"TE, NO: J.Holtz (NFC South, ID: 00-0032986)"
NO,TE,00-0033357,T.Hill,NFC,NFC South,"TE, NO: T.Hill (NFC South, ID: 00-0033357)"
NO,RB,00-0033906,A.Kamara,NFC,NFC South,"RB, NO: A.Kamara (NFC South, ID: 00-0033906)"
NO,WR,00-0034317,K.Kirkwood,NFC,NFC South,"WR, NO: K.Kirkwood (NFC South, ID: 00-0034317)"
NO,WR,00-0034765,T.Smith,NFC,NFC South,"WR, NO: T.Smith (NFC South, ID: 00-0034765)"
NO,WR,00-0035215,D.Harty,NFC,NFC South,"WR, NO: D.Harty (NFC South, ID: 00-0035215)"
NO,TE,00-0035660,K.Warring,NFC,NFC South,"TE, NO: K.Warring (NFC South, ID: 00-0035660)"
NO,RB,00-0035715,D.Gore,NFC,NFC South,"RB, NO: D.Gore (NFC South, ID: 00-0035715)"
NO,WR,00-0035844,K.Merritt,NFC,NFC South,"WR, NO: K.Merritt (NFC South, ID: 00-0035844)"
NO,TE,00-0036040,J.Johnson,NFC,NFC South,"TE, NO: J.Johnson (NFC South, ID: 00-0036040)"
NO,WR,00-0036219,M.Callaway,NFC,NFC South,"WR, NO: M.Callaway (NFC South, ID: 00-0036219)"
NO,QB,00-0036312,J.Luton,NFC,NFC South,"QB, NO: J.Luton (NFC South, ID: 00-0036312)"
NO,RB,00-0036383,E.Benjamin,NFC,NFC South,"RB, NO: E.Benjamin (NFC South, ID: 00-0036383)"
NO,TE,00-0036422,A.Trautman,NFC,NFC South,"TE, NO: A.Trautman (NFC South, ID: 00-0036422)"
NO,TE,00-0036540,D.Soehner,NFC,NFC South,"TE, NO: D.Soehner (NFC South, ID: 00-0036540)"
NO,RB,00-0036727,A.Prentice,NFC,NFC South,"RB, NO: A.Prentice (NFC South, ID: 00-0036727)"
NO,WR,00-0036939,K.Baker,NFC,NFC South,"WR, NO: K.Baker (NFC South, ID: 00-0036939)"
NO,WR,00-0037042,D.Dixon,NFC,NFC South,"WR, NO: D.Dixon (NFC South, ID: 00-0037042)"
NO,WR,00-0037239,C.Olave,NFC,NFC South,"WR, NO: C.Olave (NFC South, ID: 00-0037239)"
NO,TE,00-0037539,L.Krull,NFC,NFC South,"TE, NO: L.Krull (NFC South, ID: 00-0037539)"
NO,K,00-0037542,J.Romo,NFC,NFC South,"K, NO: J.Romo (NFC South, ID: 00-0037542)"
NO,WR,00-0037545,R.Shaheed,NFC,NFC South,"WR, NO: R.Shaheed (NFC South, ID: 00-0037545)"
NO,RB,00-0037546,A.Smith,NFC,NFC South,"RB, NO: A.Smith (NFC South, ID: 00-0037546)"
NYG,K,00-0026858,G.Gano,NFC,NFC East,"K, NYG: G.Gano (NFC East, ID: 00-0026858)"
NYG,QB,00-0028118,T.Taylor,NFC,NFC East,"QB, NYG: T.Taylor (NFC East, ID: 00-0028118)"
NYG,WR,00-0032385,S.Shepard,NFC,NFC East,"WR, NYG: S.Shepard (NFC East, ID: 00-0032385)"
NYG,TE,00-0032394,N.Vannett,NFC,NFC East,"TE, NYG: N.Vannett (NFC East, ID: 00-0032394)"
NYG,WR,00-0032980,M.Johnson,NFC,NFC East,"WR, NYG: M.Johnson (NFC East, ID: 00-0032980)"
NYG,WR,00-0033006,J.Mickens,NFC,NFC East,"WR, NYG: J.Mickens (NFC East, ID: 00-0033006)"
NYG,RB,00-0033308,M.Breida,NFC,NFC East,"RB, NYG: M.Breida (NFC East, ID: 00-0033308)"
NYG,QB,00-0033550,D.Webb,NFC,NFC East,"QB, NYG: D.Webb (NFC East, ID: 00-0033550)"
NYG,TE,00-0033611,R.Seals-Jones,NFC,NFC East,"TE, NYG: R.Seals-Jones (NFC East, ID: 00-0033611)"
NYG,WR,00-0033932,K.Golladay,NFC,NFC East,"WR, NYG: K.Golladay (NFC East, ID: 00-0033932)"
NYG,WR,00-0034286,R.James,NFC,NFC East,"WR, NYG: R.James (NFC East, ID: 00-0034286)"
NYG,WR,00-0034442,A.Proehl,NFC,NFC East,"WR, NYG: A.Proehl (NFC East, ID: 00-0034442)"
NYG,K,00-0034648,R.Santoso,NFC,NFC East,"K, NYG: R.Santoso (NFC East, ID: 00-0034648)"
NYG,WR,00-0034676,J.Washington,NFC,NFC East,"WR, NYG: J.Washington (NFC East, ID: 00-0034676)"
NYG,RB,00-0034844,S.Barkley,NFC,NFC East,"RB, NYG: S.Barkley (NFC East, ID: 00-0034844)"
NYG,TE,00-0035345,C.Myarick,NFC,NFC East,"TE, NYG: C.Myarick (NFC East, ID: 00-0035345)"
NYG,WR,00-0035359,D.Sills,NFC,NFC East,"WR, NYG: D.Sills (NFC East, ID: 00-0035359)"
NYG,WR,00-0035535,D.Slayton,NFC,NFC East,"WR, NYG: D.Slayton (NFC East, ID: 00-0035535)"
NYG,QB,00-0035710,D.Jones,NFC,NFC East,"QB, NYG: D.Jones (NFC East, ID: 00-0035710)"
NYG,TE,00-0036145,L.Cager,NFC,NFC East,"TE, NYG: L.Cager (NFC East, ID: 00-0036145)"
NYG,WR,00-0036165,I.Hodgins,NFC,NFC East,"WR, NYG: I.Hodgins (NFC East, ID: 00-0036165)"
NYG,RB,00-0036188,A.Williams,NFC,NFC East,"RB, NYG: A.Williams (NFC East, ID: 00-0036188)"
NYG,WR,00-0036254,C.Johnson,NFC,NFC East,"WR, NYG: C.Johnson (NFC East, ID: 00-0036254)"
NYG,RB,00-0036449,S.Platzgummer,NFC,NFC East,"RB, NYG: S.Platzgummer (NFC East, ID: 00-0036449)"
NYG,RB,00-0036569,G.Brightwell,NFC,NFC East,"RB, NYG: G.Brightwell (NFC East, ID: 00-0036569)"
NYG,WR,00-0037183,M.Polk,NFC,NFC East,"WR, NYG: M.Polk (NFC East, ID: 00-0037183)"
NYG,TE,00-0037374,J.Hall,NFC,NFC East,"TE, NYG: J.Hall (NFC East, ID: 00-0037374)"
NYG,RB,00-0037410,J.Corbin,NFC,NFC East,"RB, NYG: J.Corbin (NFC East, ID: 00-0037410)"
NYG,WR,00-0037443,K.Pimpleton,NFC,NFC East,"WR, NYG: K.Pimpleton (NFC East, ID: 00-0037443)"
NYG,WR,00-0037448,A.Miller,NFC,NFC East,"WR, NYG: A.Miller (NFC East, ID: 00-0037448)"
NYG,TE,00-0038115,D.Bellinger,NFC,NFC East,"TE, NYG: D.Bellinger (NFC East, ID: 00-0038115)"
NYG,WR,00-0038117,C.Robinson,NFC,NFC East,"WR, NYG: C.Robinson (NFC East, ID: 00-0038117)"
NYJ,QB,00-0026158,J.Flacco,AFC,AFC East,"QB, NYJ: J.Flacco (AFC East, ID: 00-0026158)"
NYJ,RB,00-0028064,B.Powell,AFC,AFC East,"RB, NYJ: B.Powell (AFC East, ID: 00-0028064)"
NYJ,K,00-0029621,G.Zuerlein,AFC,AFC East,"K, NYJ: G.Zuerlein (AFC East, ID: 00-0029621)"
NYJ,WR,00-0031319,D.Spencer,AFC,AFC East,"WR, NYJ: D.Spencer (AFC East, ID: 00-0031319)"
NYJ,TE,00-0032134,C.Uzomah,AFC,AFC East,"TE, NYJ: C.Uzomah (AFC East, ID: 00-0032134)"
NYJ,WR,00-0033871,C.Davis,AFC,AFC East,"WR, NYJ: C.Davis (AFC East, ID: 00-0033871)"
NYJ,WR,00-0033957,R.Adams,AFC,AFC East,"WR, NYJ: R.Adams (AFC East, ID: 00-0033957)"
NYJ,TE,00-0034270,T.Conklin,AFC,AFC East,"TE, NYJ: T.Conklin (AFC East, ID: 00-0034270)"
NYJ,QB,00-0034401,M.White,AFC,AFC East,"QB, NYJ: M.White (AFC East, ID: 00-0034401)"
NYJ,WR,00-0034419,B.Berrios,AFC,AFC East,"WR, NYJ: B.Berrios (AFC East, ID: 00-0034419)"
NYJ,RB,00-0034433,C.Bawden,AFC,AFC East,"RB, NYJ: C.Bawden (AFC East, ID: 00-0034433)"
NYJ,WR,00-0035480,M.Taylor,AFC,AFC East,"WR, NYJ: M.Taylor (AFC East, ID: 00-0035480)"
NYJ,WR,00-0035510,J.Smith,AFC,AFC East,"WR, NYJ: J.Smith (AFC East, ID: 00-0035510)"
NYJ,RB,00-0035537,T.Johnson,AFC,AFC East,"RB, NYJ: T.Johnson (AFC East, ID: 00-0035537)"
NYJ,QB,00-0035752,C.Streveler,AFC,AFC East,"QB, NYJ: C.Streveler (AFC East, ID: 00-0035752)"
NYJ,RB,00-0035831,J.Robinson,AFC,AFC East,"RB, NYJ: J.Robinson (AFC East, ID: 00-0035831)"
NYJ,WR,00-0036255,D.Mims,AFC,AFC East,"WR, NYJ: D.Mims (AFC East, ID: 00-0036255)"
NYJ,TE,00-0036510,K.Yeboah,AFC,AFC East,"TE, NYJ: K.Yeboah (AFC East, ID: 00-0036510)"
NYJ,RB,00-0036924,M.Carter,AFC,AFC East,"RB, NYJ: M.Carter (AFC East, ID: 00-0036924)"
NYJ,WR,00-0036980,E.Moore,AFC,AFC East,"WR, NYJ: E.Moore (AFC East, ID: 00-0036980)"
NYJ,QB,00-0037013,Z.Wilson,AFC,AFC East,"QB, NYJ: Z.Wilson (AFC East, ID: 00-0037013)"
NYJ,WR,00-0037156,I.Charles,AFC,AFC East,"WR, NYJ: I.Charles (AFC East, ID: 00-0037156)"
NYJ,RB,00-0037157,Z.Knight,AFC,AFC East,"RB, NYJ: Z.Knight (AFC East, ID: 00-0037157)"
NYJ,WR,00-0037159,K.Abram,AFC,AFC East,"WR, NYJ: K.Abram (AFC East, ID: 00-0037159)"
NYJ,WR,00-0037740,G.Wilson,AFC,AFC East,"WR, NYJ: G.Wilson (AFC East, ID: 00-0037740)"
NYJ,TE,00-0037805,J.Ruckert,AFC,AFC East,"TE, NYJ: J.Ruckert (AFC East, ID: 00-0037805)"
NYJ,RB,00-0038120,B.Hall,AFC,AFC East,"RB, NYJ: B.Hall (AFC East, ID: 00-0038120)"
PHI,WR,00-0033251,Z.Pascal,NFC,NFC East,"WR, PHI: Z.Pascal (NFC East, ID: 00-0033251)"
PHI,WR,00-0033733,G.Ward,NFC,NFC East,"WR, PHI: G.Ward (NFC East, ID: 00-0033733)"
PHI,K,00-0033787,J.Elliott,NFC,NFC East,"K, PHI: J.Elliott (NFC East, ID: 00-0033787)"
PHI,TE,00-0034351,D.Goedert,NFC,NFC East,"TE, PHI: D.Goedert (NFC East, ID: 00-0034351)"
PHI,WR,00-0034406,D.Cain,NFC,NFC East,"WR, PHI: D.Cain (NFC East, ID: 00-0034406)"
PHI,RB,00-0034414,B.Scott,NFC,NFC East,"RB, PHI: B.Scott (NFC East, ID: 00-0034414)"
PHI,TE,00-0034788,J.Graham,NFC,NFC East,"TE, PHI: J.Graham (NFC East, ID: 00-0034788)"
PHI,RB,00-0035243,M.Sanders,NFC,NFC East,"RB, PHI: M.Sanders (NFC East, ID: 00-0035243)"
PHI,QB,00-0035289,G.Minshew,NFC,NFC East,"QB, PHI: G.Minshew (NFC East, ID: 00-0035289)"
PHI,TE,00-0035356,T.Jackson,NFC,NFC East,"TE, PHI: T.Jackson (NFC East, ID: 00-0035356)"
PHI,WR,00-0035676,A.Brown,NFC,NFC East,"WR, PHI: A.Brown (NFC East, ID: 00-0035676)"
PHI,TE,00-0036005,N.Togiai,NFC,NFC East,"TE, PHI: N.Togiai (NFC East, ID: 00-0036005)"
PHI,TE,00-0036225,D.Keene,NFC,NFC East,"TE, PHI: D.Keene (NFC East, ID: 00-0036225)"
PHI,WR,00-0036271,T.Watkins,NFC,NFC East,"WR, PHI: T.Watkins (NFC East, ID: 00-0036271)"
PHI,QB,00-0036389,J.Hurts,NFC,NFC East,"QB, PHI: J.Hurts (NFC East, ID: 00-0036389)"
PHI,WR,00-0036439,T.Cleveland,NFC,NFC East,"WR, PHI: T.Cleveland (NFC East, ID: 00-0036439)"
PHI,TE,00-0036741,J.Stoll,NFC,NFC East,"TE, PHI: J.Stoll (NFC East, ID: 00-0036741)"
PHI,WR,00-0036912,D.Smith,NFC,NFC East,"WR, PHI: D.Smith (NFC East, ID: 00-0036912)"
PHI,RB,00-0036919,K.Gainwell,NFC,NFC East,"RB, PHI: K.Gainwell (NFC East, ID: 00-0036919)"
PHI,QB,00-0036929,I.Book,NFC,NFC East,"QB, PHI: I.Book (NFC East, ID: 00-0036929)"
PHI,RB,00-0036984,T.Sermon,NFC,NFC East,"RB, PHI: T.Sermon (NFC East, ID: 00-0036984)"
PHI,WR,00-0037039,D.Allen,NFC,NFC East,"WR, PHI: D.Allen (NFC East, ID: 00-0037039)"
PHI,TE,00-0037086,G.Calcaterra,NFC,NFC East,"TE, PHI: G.Calcaterra (NFC East, ID: 00-0037086)"
PHI,RB,00-0037131,K.Brooks,NFC,NFC East,"RB, PHI: K.Brooks (NFC East, ID: 00-0037131)"
PHI,WR,00-0037132,B.Covey,NFC,NFC East,"WR, PHI: B.Covey (NFC East, ID: 00-0037132)"
PHI,WR,00-0037630,K.Wheatfall,NFC,NFC East,"WR, PHI: K.Wheatfall (NFC East, ID: 00-0037630)"
PIT,K,00-0031136,C.Boswell,AFC,AFC North,"K, PIT: C.Boswell (AFC North, ID: 00-0031136)"
PIT,RB,00-0032897,D.Watt,AFC,AFC North,"RB, PIT: D.Watt (AFC North, ID: 00-0032897)"
PIT,RB,00-0033838,F.Edmunds,AFC,AFC North,"RB, PIT: F.Edmunds (AFC North, ID: 00-0033838)"
PIT,WR,00-0033859,J.Malone,AFC,AFC North,"WR, PIT: J.Malone (AFC North, ID: 00-0033859)"
PIT,QB,00-0033869,M.Trubisky,AFC,AFC North,"QB, PIT: M.Trubisky (AFC North, ID: 00-0033869)"
PIT,RB,00-0033955,J.McNichols,AFC,AFC North,"RB, PIT: J.McNichols (AFC North, ID: 00-0033955)"
PIT,WR,00-0034353,A.Miller,AFC,AFC North,"WR, PIT: A.Miller (AFC North, ID: 00-0034353)"
PIT,QB,00-0034771,M.Rudolph,AFC,AFC North,"QB, PIT: M.Rudolph (AFC North, ID: 00-0034771)"
PIT,WR,00-0034928,S.Sims,AFC,AFC North,"WR, PIT: S.Sims (AFC North, ID: 00-0034928)"
PIT,WR,00-0035216,D.Johnson,AFC,AFC North,"WR, PIT: D.Johnson (AFC North, ID: 00-0035216)"
PIT,RB,00-0035217,B.Snell,AFC,AFC North,"RB, PIT: B.Snell (AFC North, ID: 00-0035217)"
PIT,TE,00-0035222,Z.Gentry,AFC,AFC North,"TE, PIT: Z.Gentry (AFC North, ID: 00-0035222)"
PIT,WR,00-0035645,K.Olszewski,AFC,AFC North,"WR, PIT: K.Olszewski (AFC North, ID: 00-0035645)"
PIT,TE,00-0035671,J.Sternberger,AFC,AFC North,"TE, PIT: J.Sternberger (AFC North, ID: 00-0035671)"
PIT,WR,00-0035703,M.Boykin,AFC,AFC North,"WR, PIT: M.Boykin (AFC North, ID: 00-0035703)"
PIT,WR,00-0035891,C.White,AFC,AFC North,"WR, PIT: C.White (AFC North, ID: 00-0035891)"
PIT,WR,00-0036110,J.Bradley,AFC,AFC North,"WR, PIT: J.Bradley (AFC North, ID: 00-0036110)"
PIT,RB,00-0036278,J.Huntley,AFC,AFC North,"RB, PIT: J.Huntley (AFC North, ID: 00-0036278)"
PIT,RB,00-0036336,A.McFarland,AFC,AFC North,"RB, PIT: A.McFarland (AFC North, ID: 00-0036336)"
PIT,WR,00-0036495,T.Vaughns,AFC,AFC North,"WR, PIT: T.Vaughns (AFC North, ID: 00-0036495)"
PIT,RB,00-0036893,N.Harris,AFC,AFC North,"RB, PIT: N.Harris (AFC North, ID: 00-0036893)"
PIT,TE,00-0036894,P.Freiermuth,AFC,AFC North,"TE, PIT: P.Freiermuth (AFC North, ID: 00-0036894)"
PIT,RB,00-0037111,M.Teague,AFC,AFC North,"RB, PIT: M.Teague (AFC North, ID: 00-0037111)"
PIT,RB,00-0037226,M.Durant,AFC,AFC North,"RB, PIT: M.Durant (AFC North, ID: 00-0037226)"
PIT,RB,00-0037228,J.Warren,AFC,AFC North,"RB, PIT: J.Warren (AFC North, ID: 00-0037228)"
PIT,WR,00-0037247,G.Pickens,AFC,AFC North,"WR, PIT: G.Pickens (AFC North, ID: 00-0037247)"
PIT,TE,00-0037304,C.Heyward,AFC,AFC North,"TE, PIT: C.Heyward (AFC North, ID: 00-0037304)"
PIT,RB,00-0037389,M.Borghi,AFC,AFC North,"RB, PIT: M.Borghi (AFC North, ID: 00-0037389)"
PIT,TE,00-0037424,J.Rigg,AFC,AFC North,"TE, PIT: J.Rigg (AFC North, ID: 00-0037424)"
PIT,TE,00-0037451,R.Williams,AFC,AFC North,"TE, PIT: R.Williams (AFC North, ID: 00-0037451)"
PIT,K,00-0037645,N.Sciba,AFC,AFC North,"K, PIT: N.Sciba (AFC North, ID: 00-0037645)"
PIT,WR,00-0037646,T.Snead,AFC,AFC North,"WR, PIT: T.Snead (AFC North, ID: 00-0037646)"
